id,created_at,text
1144276520875319296,2019-06-27 16:09:16,"I'm done playing by a different set of rules. As president, I'll push to require states to use independent redistricting commissions to draw fair districts. And if Republicans keep standing in the way of fair elections, I'll push to end the filibuster. https://t.co/WV0BqmmKjU"
1144276520090918913,2019-06-27 16:09:16,"Mitch McConnell says efforts to stop gerrymandering are ""socialist"". Chief Justice Roberts pays lip service to the idea that gerrymandering is bad—but then hands the keys to our democracy over to a bunch of cheats. Republicans are trying to rig the game, and they're winning."
1144276518786555906,2019-06-27 16:09:16,The Supreme Court's decision is an abomination. Five Republican-appointed justices gave the green light to partisan gerrymandering—which lets Republicans pursue their extreme agenda without accountability to the people. It's bad for our democracy and we need to fight back.
1144237476451639296,2019-06-27 13:34:07,You bet I have a plan to deal with Mitch McConnell. We need leadership from within our government—but we also need a grassroots movement to push from the outside and make Congress reflect the will of the people. And we have to get rid of the filibuster. #DemDebate https://t.co/X0ODfTwoRy
1144088262174228480,2019-06-27 03:41:12,The economy is doing great for a thinner and thinner slice at the top. It’s time to build an economy that works for all of us. And I’ve got plans for that. #DemDebate https://t.co/8oBa9a4TmB
1144086118465515520,2019-06-27 03:32:41,"I spent a big chunk of my life studying why families go broke, and one of the top reasons is a medical emergency. That's not right. Our system is working for corporations making a profit, but not for families. That's why I'm fighting for #MedicareForAll. #DemDebate https://t.co/MhYfR235nG"
1144082731745366016,2019-06-27 03:19:13,"RT @TeamWarren: .@ewarren can make our government, our economy, and our country work for everyone—not just those at the top. #DemDebate htt…"
1144080356729118721,2019-06-27 03:09:47,"I just stepped off the #DemDebate stage. I have a lot of plans for big, structural change, but we can only do this together. Chip in $3 or more before our big FEC deadline and help power our grassroots campaign. https://t.co/pSUwFnT5qq"
1144079755987341312,2019-06-27 03:07:24,"I’m in this fight for a government and an economy that works for the people, not the rich and the powerful. I promise you this: I will fight for you as hard as I fight for my family. #DemDebate"
1144074674898382848,2019-06-27 02:47:13,No one should be above the law—that includes the president of the United States. I’ve got a plan to ensure that a sitting president can be held accountable for committing a crime. #DemDebate https://t.co/v1pgkcdRDm
1144073763279032320,2019-06-27 02:43:35,"The threat posed by climate change is real, it’s man-made, and we are running out of time. We need to take big, bold actions now—starting with the #GreenNewDeal. #DemDebate"
1144071973724704769,2019-06-27 02:36:29,RT @TeamWarren: Yeah—@ewarren even has a plan to deal with Mitch McConnell. #DemDebate https://t.co/CymR0WfH3F
1144071873149509633,2019-06-27 02:36:05,"We’re fighting for big, structural change to our economy, our government, and our democracy. And if Senate Republicans continue the same playbook of blocking legislation like they did with President Obama, I’ll get rid of the filibuster. #DemDebate"
1144069425164881921,2019-06-27 02:26:21,RT @TeamWarren: Gun violence is a public health emergency in this country. No child should be wondering whether they will be safe in school…
1144068693288194048,2019-06-27 02:23:26,"I have a LOT of plans—and you bet I have one to deal with Mitch McConnell. In the 2020 elections, we have to push from outside, have leadership on the inside, &amp; make congress reflect the will of the people. The fight still goes on to make Congress work for the people. #DemDebate"
1144066036557389829,2019-06-27 02:12:53,"Since running for president, I’ve answered thousands of questions. Earlier this month, a kid asked me, “What are you doing to keep children safe?” We need to fight this with every tool in the toolbox—that means treating it like the public health emergency that it is. #DemDebate"
1144062449005600768,2019-06-27 01:58:38,"As president, I would make sure our country gets back on the 2015 Iran Deal. We can't afford another forever war, and I’m fighting to stop Donald Trump from dragging us into another one. #DemDebate"
1144060533395664896,2019-06-27 01:51:01,"I went to the Homestead, FL detention center today. It’s hot and barren, with a completely enclosed fence. I saw children being marched from one building to another in single file lines. No laughing, no playing. These are children who are prisoners. #DemDebate"
1144059197568561154,2019-06-27 01:45:42,"RT @TeamWarren: .@ewarren has a plan to protect our right to safe, legal abortion—even if #RoeVWade is overturned. #DemDebate https://t.co/…"
1144059064764305408,2019-06-27 01:45:11,RT @ewarren: I agree with @JulianCastro: We shouldn't criminalize families trying to build a better future. We need comprehensive immigrati…
1144058026325884934,2019-06-27 01:41:03,"RT @TeamWarren: Our health care system is working great for companies making massive profits, but not for families who can't afford health…"
1144056591957876737,2019-06-27 01:35:21,"Every woman should have access to the full range of reproductive services, including safe, legal abortion. Most people in this country support #RoeVWade, and we need to make it the law. Here’s my plan to protect reproductive health. #DemDebate https://t.co/iBzvjDBCL4"
1144055747283685376,2019-06-27 01:32:00,"Women’s rights are human rights. We need to:

✔ Protect #RoeVWade.
✔ End the #HydeAmendment.
✔ Defend #TitleX family planning funding.
✔ Ensure that #MedicareForAll includes contraception and abortion coverage.

https://t.co/iBzvjDBCL4

#DemDebate"
1144055312124657665,2019-06-27 01:30:16,"RT @TeamWarren: Health care is a basic human right, and @ewarren will fight for basic human rights. She's fighting for #MedicareForAll. #De…"
1144055120109494273,2019-06-27 01:29:30,RT @TeamWarren: The economy is doing great for a thinner and thinner slice at the top. @ewarren has plans to build an economy that works fo…
1144055079416336384,2019-06-27 01:29:21,RT @TeamWarren: We need courage in Washington to take on corruption. @ewarren will never back down from that fight. #DemDebate https://t.co…
1144054259547299850,2019-06-27 01:26:05,"Yes, I would support government-run insurance. Health care is a basic human right, and we fight for basic human rights. We need #MedicareForAll. #DemDebate"
1144054071776763904,2019-06-27 01:25:20,"I’ve spent my life studying why families go broke, and one of the biggest reasons is the cost of health care. Well, I'm tired of insurance companies getting rich while families get stretched to a breaking point. We need #MedicareForAll. #DemDebate"
1144053575410208768,2019-06-27 01:23:22,"Some politicians say Medicare for All isn’t possible. What they’re really saying is that they don’t want to fight. Well, I do. Health care is a basic human right. We fight for basic human rights, and that’s why I’m fighting for #MedicareForAll. #DemDebate"
1144053167128219653,2019-06-27 01:21:45,"As president, I will pursue an agenda of economic patriotism, using new and existing tools to defend and create quality American jobs and promote American industry. It's time to put American workers ahead of Wall Street bonuses and multinational profits. https://t.co/pWxwPq2uV1"
1144051788594720768,2019-06-27 01:16:16,"There’s way too much consolidation in our economy. It hurts our workers, our entrepreneurs, our consumers, and our economy. I want to return the government to the people, and calling out the names of monopolies is saying that I have the courage to go after them. #DemDebate"
1144049428447342592,2019-06-27 01:06:53,"Right now our economy is doing great for a thinner and thinner slice at the top. It’s not doing great for the rest of Americans. It’s corruption plain and simple—and we need to address it head on and make big, structural change to fight it. #DemDebate"
1144032425602949120,2019-06-26 23:59:20,"I’m on my way to the first #DemDebate with Bruce and the team! I’m looking forward to talking about why I’m in this race and my plans for big, structural change. https://t.co/Yq8ND9lgUK"
1144014082649010178,2019-06-26 22:46:26,"Person to person, one dollar at a time, we’re building a grassroots movement. Our personal fundraising pages will make it easy to bring your friends and family into this fight! Here’s how to create your own: https://t.co/c3Wy2vT53s https://t.co/bsAc5elzo1"
1144009261636341761,2019-06-26 22:27:17,I hope you’ll tune in at 9:00 PM ET tonight! #DemDebate https://t.co/gRYaII6lKi
1144005872345124866,2019-06-26 22:13:49,"When women fight, women win. Congratulations, @CabanForQueens! https://t.co/rERCtTE0J0"
1143997225225396226,2019-06-26 21:39:27,"Homestead is hot and barren, with a completely enclosed fence. I saw children being marched from one building to another in single file lines. No laughing, no playing. These are children who are prisoners. https://t.co/7WB4G8sI5n"
1143985808468299776,2019-06-26 20:54:05,"At Homestead, a young girl named Lea gave me a hand-written note. She wrote about the fear of losing her parents to deportation and asked me to fight for immigration reform.

No child should have to grow up with that fear. Lea, I promise: We’re in this fight together. https://t.co/sKbYJ9uQEk"
1143977278088630272,2019-06-26 20:20:11,"I went to the Homestead, FL detention center this morning to shine a light on what’s happening. There’s no place in this country for operating private prisons that profit off of cruelty. Detention centers like the one in Homestead should be shut down. https://t.co/ttv7ziHATs"
1143965061616214016,2019-06-26 19:31:39,"These are children—children. 

Mark Morgan’s racist comments disqualify him from leading @ICEGov. https://t.co/pxajk1nmLI"
1143952730224041985,2019-06-26 18:42:39,.@ICEGov needs to answer for its misuse of solitary confinement. Immigrants in custody who are disabled or are sexual assault survivors may be especially in need of protection. Locking them up for at least 22 hours a day is cruel and unnecessary. https://t.co/KDFKBU1XuE
1143915179505266688,2019-06-26 16:13:26,"RT @JeffMerkley: My friend @ewarren is down at the unlicensed, for-profit child prison at Homestead right now, drawing attention to the chi…"
1143914533959929856,2019-06-26 16:10:52,"“They had been detained for weeks without access to soap, clean clothes or adequate food.”

This is inhumane. In a Warren administration, we will treat immigrant children with the dignity and respect they deserve. https://t.co/WdkLClM4KJ"
1143896120038440960,2019-06-26 14:57:42,There are a lot of different ways that we get in the fight. And one of them is that you show up. I'm at the Homestead detention center today and I hope you'll be watching. https://t.co/vzXqUlaiIM
1143885585817509888,2019-06-26 14:15:50,"A year ago today, SCOTUS made the wrong decision in upholding Donald Trump’s bigoted and xenophobic Muslim ban. We won’t forget and we won’t stop fighting until Muslims are treated with dignity and respect."
1143873918475931653,2019-06-26 13:29:28,"Yesterday at my town hall in Miami, I got asked an important question: Would I go to the Homestead detention center to shine a light on what's happening? The answer is yes. I'll be there today and I hope you'll join me. https://t.co/gIAwNywrn7"
1143866153695174657,2019-06-26 12:58:37,"RT @DebbieforFL: Thank you @ewarren for visiting #Homestead today in my district #FL26. You can see it in the crowd in Miami, when the ques…"
1143714886079406081,2019-06-26 02:57:32,"The Mueller report made clear that the president obstructed justice multiple times. If he were anyone else, he'd be in handcuffs. Attorney General Barr can try to cover for the president all he wants, but the American people deserve to hear the full truth from Mueller himself."
1143700471363887107,2019-06-26 02:00:15,"At tonight's town hall in Miami, an audience member asked me to go to the Homestead detention center—where the Trump administration is holding immigrant children separated from their families—and shine a light on what's happening. I'll be there tomorrow—and I hope you'll join me. https://t.co/tf2aaOakbF"
1143673420628058117,2019-06-26 00:12:46,"One way I’m fighting is through my plan to end for-profit detention centers, which have made millions implementing Trump’s cruel immigration policies. Today 73% of detained immigrants are held in private detention facilities. Under my plan, we’ll end this. https://t.co/CUduueEhP5"
1143673419780755458,2019-06-26 00:12:46,"I saw the same thing at a @CBP processing center in McAllen, TX. I'll never forget listening to traumatized moms and children begging to be reunited. Let me make this clear: I'll never stop fighting Trump's cruel immigration policies. 
https://t.co/ZO8bQMZFpo"
1143672963541213184,2019-06-26 00:10:57,"This week marks a year since I visited the Port Isabel Reunification Center in Los Fresnos, TX to find out what was really happening to immigrant families ripped apart at our border. I saw right away: It wasn’t a unification center—it was a prison. https://t.co/aAP8eTmN8e"
1143658365123534858,2019-06-25 23:12:57,"I agree with @JulianCastro: We shouldn't criminalize families trying to build a better future. We need comprehensive immigration reform that's in line with our values and creates a pathway to citizenship for undocumented immigrants, including our DREAMers. https://t.co/KWzLmVnEBF"
1143645254379364352,2019-06-25 22:20:51,Queens: I hope you make your voices heard today and vote for @CabanForQueens if you haven’t already! Polls are open until 9:00 PM ET. https://t.co/RecNhXVzZR
1143640076586536961,2019-06-25 22:00:16,I stand with the hundreds of @Wayfair employees who are planning to stage a walkout at their Boston headquarters tomorrow. The safety and well-being of immigrant children is always worth fighting for. https://t.co/L3hqbazX4l
1143605711257133057,2019-06-25 19:43:43,"Amazon has too much power. Under my plan to #BreakUpBigTech, entrepreneurs would have a fighting chance to compete against tech giants. https://t.co/EdsvdA48tE"
1143588173584510976,2019-06-25 18:34:02,"My #UltraMillionaireTax is a two-cent tax on the 75,000 biggest fortunes in the country. We’d use it to pay for #UniversalChildCare, student loan debt relief, free public college, and a lot more. Here’s how it works. https://t.co/mtPIBSNdN6"
1143557918727593987,2019-06-25 16:33:48,"The Trump administration’s treatment of the people of Puerto Rico continues to be a complete failure. Our government needs to follow through and provide the aid that is rightfully owed to the island immediately. 
https://t.co/PEisWubibu"
1143544043491737600,2019-06-25 15:38:40,"It’s time to make voting easy and convenient, stop racist voter suppression, and secure our elections. I've got a plan to protect our democracy. https://t.co/aGAAlzqaeS"
1143534551454687233,2019-06-25 15:00:57,"Our democracy is too important for our elections to be under-resourced, undermined, and vulnerable. We need to do everything we can to make sure our elections are convenient, professional, and secure. Read my full plan here: https://t.co/WV0BqmmKjU"
1143534550410321920,2019-06-25 15:00:57,"Finally, we'll provide incentives and resources for states to improve state elections—and where racist or corrupt politicians refuse to follow the law, the federal government will temporarily take over the administration of their federal elections to guarantee the right to vote."
1143534549290426368,2019-06-25 15:00:57,"Next, we'll establish federal standards to ensure everyone can vote, including mandating automatic and same-day registration, early voting, and vote by mail. No more arbitrary voter purges, registration issues, or gerrymandering. We'll make Election Day a national holiday."
1143534548380205057,2019-06-25 15:00:56,"I'll start by making sure federal elections get state-of-the-art machines, ballots, and security. We'll replace every voting machine in the country with state-of-the-art equipment and require adoption of a uniform federal ballot. And we'll make sure those systems are secure."
1143534547193278466,2019-06-25 15:00:56,"We need a constitutional amendment to guarantee the right to vote. But we can also take action now. The federal government has the power to regulate federal elections, secure our democracy, and put a stop to racist voter suppression."
1143534545901408257,2019-06-25 15:00:56,Our elections are less secure than your Amazon account. They're under-resourced and undermined by partisan and racist officials who try to stop people from exercising their right to vote. We need to protect our democracy—and I’ve got a plan for that: https://t.co/WV0BqmmKjU
1143340262053306369,2019-06-25 02:08:55,"We have a plan for #UniversalChildCare—and a bill to make it happen. I’m glad we’re in this fight together, @Deb4CongressNM! https://t.co/wDR2KSlYvM"
1143329682236018688,2019-06-25 01:26:52,"Our laws should reflect our values. A two-cent tax on the wealthiest 75,000 fortunes will help rebuild the middle class and give every family a shot at the American dream. https://t.co/N0NiyiXJbr"
1143319724866048000,2019-06-25 00:47:18,RT @rweingarten: .@ewarren unveiled a plan Friday to end the government’s relationship with private prisons if she’s elected to the White H…
1143309594497867777,2019-06-25 00:07:03,"Donald Trump’s cruel threats of ICE raids are fear-mongering of the worst kind. In a Warren administration, we’ll protect immigrant families, fix our broken immigration system, and treat immigrant communities with dignity. https://t.co/LdEj4ncRRR"
1143299561965969409,2019-06-24 23:27:11,"Private immigration detention centers are exploitation for profit, and I’m glad to see Illinois ban them. My plan to end private prisons would require the rest of the country to do the same. https://t.co/yTdXkYTYyV"
1143296545690984448,2019-06-24 23:15:12,RT @splcenter: Many of our nation's immigrant stories are not so different from those of families who are striving to be part of the Americ…
1143281072228245512,2019-06-24 22:13:43,"My friend and colleague, Senator @JeanneShaheen, is a champion for working families in New Hampshire. Today a Republican opponent announced he’s running against Jeanne in 2020. We re-elected Jeanne in 2014, and we’ll do it again. Let’s help her win: https://t.co/ahO5kqV5fC"
1143278041201881093,2019-06-24 22:01:40,"People are dying at our border: Moms, babies, families sacrificing everything. We need to fix the Trump administration’s hateful immigration policies that treat immigrants like animals. Immigrant families belong together and deserve to be treated with respect. https://t.co/JB91WWd8cv"
1143192697139806208,2019-06-24 16:22:33,"The cost of child care held me back until my Aunt Bee stepped in to help take care of Alex and Amelia. Today, it’s holding Amber and her family back. Every family should have access to high-quality, affordable child care. #UniversalChildCare https://t.co/iUiQa1u3zk"
1143153528648732672,2019-06-24 13:46:54,"Together we can rebuild the middle class and make our economy work for the people—and I’ve got plans to actually make it happen. Will you chip in $3 to help build our grassroots operation across the country? Let’s dream big, fight hard, and win. https://t.co/UoJBy0H8pR"
1142988727951794181,2019-06-24 02:52:03,The 8 Mile Wall was built in the 1940s to separate Black families from white families. It’s a powerful reminder that Black Americans still feel the impact of generations of racist federal laws—and a reminder that our government needs to make it right. https://t.co/5oC8wrCvz5
1142982327758467073,2019-06-24 02:26:37,"When workers fight, workers win. https://t.co/41kHcCZ1Te"
1142942632538234882,2019-06-23 23:48:53,"Our criminal justice system is broken—and race is right at the center of what's wrong. Black Americans are more likely to be arrested, wrongfully convicted, and serve longer sentences than white Americans. It’s time to end mass incarceration. https://t.co/Sr4PReS9v7"
1142927411169898497,2019-06-23 22:48:24,This is an attempt to block the young people at @IowaStateU from voting and making their voices heard. The HD46 special election should be held on a different Tuesday. https://t.co/yEENGxOhAO
1142922918244048898,2019-06-23 22:30:32,"@yasminradjy @SenGillibrand @PPact I was glad to celebrate with you, and I’m proud to fight alongside you for reproductive justice!"
1142860388876374016,2019-06-23 18:22:04,"If we want to beat Donald Trump, we have to grow this grassroots movement. I'm not spending my time behind closed doors with millionaires—I'm doing town halls and talking with grassroots voters. I need you to be a part of this fight: https://t.co/MDilGf849t https://t.co/oGJrB0XP2d"
1142813317028823040,2019-06-23 15:15:01,"If you don’t want to take a bath, hide under the bed. No one will notice. https://t.co/KaKzMD23oh"
1142597507018579968,2019-06-23 00:57:28,It wasn’t until marriage equality became law that gay &amp; lesbian couples could jointly file tax returns—so they paid more in taxes. Our government owes them more than $50M for the years our discriminatory tax code left them out. We must right these wrongs. https://t.co/OZQcfVilSs
1142582387462873090,2019-06-22 23:57:23,"Twenty years ago, SCOTUS made a landmark decision in #Olmstead v. L.C.: All people have a right to live a life of dignity and independence. Let’s recommit to fighting to see this promise truly fulfilled for the disability community. https://t.co/8t4R7El1ET"
1142572738869153792,2019-06-22 23:19:03,"RT @PPact: WATCH @EWarren on protecting access to safe, legal abortion: “We need to pass a federal law to make Roe v. Wade the rule of the…"
1142568672390782977,2019-06-22 23:02:54,"Thank you @PPact for having me at today's #WeDecide Forum. It's time to go on the offense to protect #RoeVWade—and, in a Warren administration, we will defend and expand access to reproductive health care for everyone. https://t.co/DB1MoZ97Rm"
1142555761677148161,2019-06-22 22:11:35,"Thank you, @SenGillibrand! https://t.co/lIvhdY9aG1"
1142546043495682049,2019-06-22 21:32:58,I had a fabulous time at the @scdp convention! This election is about one fundamental question: Who does this government work for? Right now it's working great for a thinner and thinner slice at the top. I'm in this fight because I want to make government work for all of us. https://t.co/6JaBvvFhRH
1142519728612794368,2019-06-22 19:48:24,"Grateful for everyone who came out to the #ClyburnFishFry last night—I had a fantastic time. Thank you for welcoming us to South Carolina, Rep. Clyburn! https://t.co/oL7dDNNm0K"
1142510735257456640,2019-06-22 19:12:40,"@AlexDiLalla I’m so glad you listened! Bodie is adorable, and I know you two will be a great team."
1142502793720279045,2019-06-22 18:41:07,"Fun fact: Meryl Streep and I share a birthday down to the year. (One of us has won multiple Oscars. Hint: It was definitely not me.) Happy birthday, Meryl! https://t.co/ugYk8udQvn"
1142495822912921601,2019-06-22 18:13:25,Thank you all so much! I couldn’t think of a better way to spend my birthday than by being out on the trail with all of you. https://t.co/JveCxDnRQt
1142267887291445248,2019-06-22 03:07:41,RT @SCforWarren: #SCforWarren showing strong outside the #ClyburnFishFry. Stop by to dream big and fight hard with us! https://t.co/jJSAcQ4…
1142260100289236992,2019-06-22 02:36:44,I love taking selfies—but @CoryBooker has longer arms! https://t.co/6KeQCliVbU
1142251258234974208,2019-06-22 02:01:36,"It was wonderful to speak with @RevJJackson about our vision for the future of this country and the big, structural change we need in order to make it a reality. https://t.co/WjeMcSMuqy"
1142243016901582848,2019-06-22 01:28:51,"Happy #NationalSelfieDay! Want to grab a drink soon with Bruce and me? Make a donation of any amount and you’ll automatically be entered for the chance to win a trip to meet us. Of course, Bailey will be there too. https://t.co/oT9OieOgg9 https://t.co/NMaCtD6Ig7"
1142210581744836608,2019-06-21 23:19:58,RT @TeamWarren: Who’s ready for the fish fry? https://t.co/ddqIlc0Ojs
1142205339288440832,2019-06-21 22:59:08,"Welcome to the fight, Ella! I can tell she’s already dreaming big (and napping hard). https://t.co/WoJGGasja9"
1142193367717154816,2019-06-21 22:11:34,Extremist Republicans are afraid of young people and communities of color making their voices heard. It should be safe and easy to vote—that’s why I’m fighting for a constitutional amendment that guarantees the right to vote and to have that vote counted. https://t.co/rJHfXtXKvU
1142184345714561024,2019-06-21 21:35:43,"I do! My latest plan would ban all private prisons &amp; detention facilities and stop companies from charging incarcerated &amp; detained people for essential services, so we can finally put an end to private profiteering off of cruelty. Read all about it here: https://t.co/CUduuemGqv https://t.co/Y9xW6wJucP"
1142171932378447872,2019-06-21 20:46:23,"RT @TelemundoNews: ""La inmigración nos hace más fuertes, no más débiles"", respondió @ewarren en #NALEOMiami, a una pregunta sobre su plan m…"
