id,created_at,text
1098671333104381952,2019-02-21 19:50:32,"Let’s be clear: there is no “emergency” down at our border. The people of Lawrenceville, GA agreed – immigration makes our country stronger, not weaker. https://t.co/uIAcGHrnRh"
1098630258255908867,2019-02-21 17:07:19,Our candidates should be held to the highest standards of accountability. That’s why I proposed a plan to #EndCorruptionNow. That's why I put 10 years of my tax returns online. And that's why our movement is powered by grassroots supporters – not federal lobbyists or Super PACs.
1098603728179998725,2019-02-21 15:21:54,"A majority of Americans – Democrats and Republicans alike – want the rich and powerful to pay their fair share. A majority of Americans want real, structural change like my #UltraMillionaireTax. https://t.co/HnNCvOpbF3"
1098419746784137217,2019-02-21 03:10:49,"Last night, I told @JKCorden and @50cent that we have a chance for real, structural change in 2020. And that includes my new plan for #UniversalChildCare. https://t.co/V095iUN73x"
1098403745103335425,2019-02-21 02:07:14,We need #UniversalChildCare that's high-quality and affordable – no parent should have to choose between breaking the budget or settling for lower-quality care. My new plan would help American families out of that bind. https://t.co/39UV68ql7R
1098346442417164289,2019-02-20 22:19:32,"RT @BostonGlobe: Elizabeth Warren talked universal child care, tattoos with 50 Cent and James Corden https://t.co/BBeCB3fge3"
1098330199572254720,2019-02-20 21:15:00,"RT @AsteadWesley: ""break up with lobbying as we know it, i'm bored."" https://t.co/67O9jTvVzy"
1098322062895169536,2019-02-20 20:42:40,"Only Mueller should decide when his investigation is complete. And when he's done, the public should see his full report. Not a summary. Full stop."
1098310810089283586,2019-02-20 19:57:57,One of my favorite parts about being on the road is taking pictures (and getting hugs!) from people all across this country. Here's what my first full day in Iowa as a candidate for President of the United States looked like. https://t.co/nnJIodYXf4
1098281737271037952,2019-02-20 18:02:25,"Universal Child Care, my In-N-Out order, and tattoos. Covered a lot of ground on the @latelateshow last night with @50cent (and grandkids are jealous I got to meet @ArianaGrande!) https://t.co/Q5o8bRocww"
1098258894139416576,2019-02-20 16:31:39,"Right now, high-quality child care is a privilege for the rich. I believe it should be a fundamental right for everyone. We need #UniversalChildCare. https://t.co/nG4MfDjg9F"
1098247488916676608,2019-02-20 15:46:20,"RT @nwlc: We're excited to see child care as part of the national conversation. Child care is a basic support that helps parents work, give…"
1098245222717407233,2019-02-20 15:37:20,RT @rweingarten: This is great news for working families. You can always count on @ewarren for progressive plans like Universal Child Care.…
1098241136903274498,2019-02-20 15:21:06,RT @liuba4congress: My mom is my “Aunt Bee” and I couldn’t have run for Congress without her. But not everyone is that lucky. Affordable ch…
1098222877227270145,2019-02-20 14:08:32,"Donald Trump’s ridiculous wall isn’t a “national emergency.” But our country’s opioid crisis is. Rep. Elijah @ReElectCummings and I are proposing big, structural change to fix it. https://t.co/V9PZ6xgcbp"
1098083571401613314,2019-02-20 04:54:59,"In less than an hour, tune in to watch my interview with @JKCorden on @thelatelateshow! https://t.co/D9iG0adx1J"
1098076900239527937,2019-02-20 04:28:28,"I was glad to talk with @TheYoungTurks crew today. I’m fighting for big, structural change – and it starts at the grassroots level with all of us fighting together. https://t.co/EcDP5cQzT6"
1098041093214650370,2019-02-20 02:06:11,"Thanks for having me, @PodSaveAmerica! It was great to talk with @TVietor08 about my 2020 agenda, and I love-love-loved meeting @jonfavs and @jonlovett’s dogs (don’t tell Bailey). Tune in to Thursday’s episode to hear our conversation. https://t.co/Sc9gY58UK4"
1098040381156007940,2019-02-20 02:03:22,"RT @PodSaveAmerica: Hard-hitting exchange between @ewarren and a local Pundit. 

Full interview out on Thursday's Pod! https://t.co/eSDlums…"
1098012065120374784,2019-02-20 00:10:51,RT @ilyseh: .@ewarren's plan for universal child care would be a game changer for working parents and go a long way towards achieving repro…
1098010204225093639,2019-02-20 00:03:27,Hope you can stay up to catch me on the @latelateshow with @JKCorden tonight! We'll talk about my new plan for #UniversalChildCare and more. Tune in to @CBS at 12:35 AM ET.
1097987632603295751,2019-02-19 22:33:45,"We need real, structural change to protect our environment – and we need it now. https://t.co/G8ZzPKRBX6"
1097964580582633476,2019-02-19 21:02:09,"I remember calling my Aunt Bee and breaking down, telling her between tears that I couldn’t make it work and had to quit my job. Then Aunt Bee said 11 words that changed my life: “I can’t get there tomorrow, but I can come on Thursday.” #UniversalChildCare https://t.co/HBwlVxceht"
1097934741209317376,2019-02-19 19:03:35,The @NRA works around the clock to buy off or bully members of Congress and gut opportunities for real gun reform. I'm not afraid to fight back and I won't take a dime of the NRA’s money. https://t.co/SOHXfm29lj
1097899432115347456,2019-02-19 16:43:17,"Donald Trump's ridiculous ""national emergency"" is illegal. We need to fight this with everything we’ve got. https://t.co/kJI3e5KSjl"
1097855400811081729,2019-02-19 13:48:19,"Our kids are our future – but right now, we’re shortchanging them. Add your name to the petition: Every kid aged 0 to 5 in America should have access to high-quality, affordable child care and early learning. #UniversalChildCare https://t.co/zRPQmKAvYo"
1097853249921654784,2019-02-19 13:39:46,"Under my new plan, we'll:
☑️Partner with local providers  to create a network of child care options
☑️Put communities in charge &amp; hold providers to high standards
☑️Pay child care &amp; preschool workers like comparable public school teachers
☑️Pay for it with my #UltraMillionaireTax"
1097851454579200002,2019-02-19 13:32:38,"My new plan quadruples the federal investment in child care and early education, and offers high-quality options completely free to millions of families. Every kid in America deserves a fair shot at success."
1097848500585488385,2019-02-19 13:20:54,"Child care should be a fundamental right, period. I remember how hard it was to find affordable, high-quality child care for my two kids when I was a working mom – and it's a zillion times harder today. Here’s how my #UniversalChildCare plan works. https://t.co/YAFGzqZ0hX"
1097844452255825921,2019-02-19 13:04:49,"Another big, structural change we need: #UniversalChildCare. I’m proposing a bold new plan that guarantees high-quality child care and early education for every child in America. It will be free for millions of families, and affordable for everyone. https://t.co/lFFZO7kwhu"
1097750496658374656,2019-02-19 06:51:28,"This did, too. https://t.co/n2bkqnItAN"
1097739788633792512,2019-02-19 06:08:55,This got a huge applause tonight: https://t.co/OJfxEp6vyE
1097702726333390849,2019-02-19 03:41:38,"Watch live as I discuss my #UniversalChildCare plan. Child care should be a right, not a privilege for the rich.  https://t.co/QZpvO8Ci2x"
1097651182686871553,2019-02-19 00:16:49,"I’ll never give up on your kids and grandkids, and I’ll never give up on their futures. That’s a promise. https://t.co/FKeZCRZ5JN"
1097610977942650880,2019-02-18 21:37:04,"This is corruption – plain and simple. When my #EndCorruptionNow bill becomes law, no more side-stepping the rules. It will be illegal for @RyanZinke – and everyone else – to go right from the White House to a big lobbying job. https://t.co/7Ag2u5dmg4"
1097559902971678720,2019-02-18 18:14:07,I stand with the thousands of people across the country who are making their voices heard and fighting the #FakeTrumpEmergency. A fake “national emergency” at the border is fear-mongering of the worst kind – and we’re not falling for it. https://t.co/JhiuWZS4on
1097521754338181120,2019-02-18 15:42:31,"MA-born artist and critic Lorraine O’Grady has broken barriers in an industry dominated by white men. Her powerfully important paintings and performances have paved the way for other African American women artists, and give a voice to the voiceless. #BHM https://t.co/vcPMxfw25S"
1097494141234229254,2019-02-18 13:52:48,I’m pretty sure our #Warren2020 Official Good Boy had a great time in Lawrence last weekend. https://t.co/AxVVje3Sng
1097331761435037696,2019-02-18 03:07:34,It’s time for Democrats to declare who we are. We are the party of the people. We are the party that believes that every kid should get a fighting chance to build a future. We're going to take 2020 as our chance to build a movement and change this country for the better.
1097328378405928960,2019-02-18 02:54:07,"Our fight is to change the rules so that our government, our economy, and our democracy work for everyone in Nevada and across the country. https://t.co/EPNz44KDAS"
1097229566450507776,2019-02-17 20:21:28,"Just touched down in Las Vegas. See you soon, Nevada! https://t.co/ZmQTcidxtN"
1097224767525081089,2019-02-17 20:02:24,Aretha Franklin will always command respect. She defined decades of history – singing at MLK’s funeral and President Obama’s inauguration – and inspires us to keep fighting for civil rights and equality. #BHM https://t.co/hZuJBXDjPm
1097201148061237248,2019-02-17 18:28:33,"We’re fighting for big, structural change in this country and that includes making real investments in childcare. https://t.co/V0vkfHGNE5"
1096927345368334338,2019-02-17 00:20:33,"We need to take power away from the wealthy and well-connected and put it back in the hands of the people – in South Carolina, Georgia, and everywhere else. https://t.co/qAtaFSt2H2"
1096865426980724736,2019-02-16 20:14:31,"Back when I was a kid, a minimum-wage job could support a family of three. Today, a full-time minimum-wage job in America won’t keep a mama and a baby out of poverty. Our movement is about making real, fundamental change to fix this."
1096815573839822848,2019-02-16 16:56:25,"Hello, Greenville! Great to be back in South Carolina this morning. https://t.co/tSmCVE50ht"
1096786055074844673,2019-02-16 14:59:07,The #FakeTrumpEmergency is an abuse of power. Full stop.
1096563374459097088,2019-02-16 00:14:16,"Today, at least five people were killed and several first responders were injured in a mass shooting in Aurora, Illinois. I’m heartsick for the victims, their loved ones, and the brave Aurora Police Department. #GunReformNow"
1096509523353890818,2019-02-15 20:40:17,"Surprise, surprise. Former @Interior Secretary @RyanZinke resigned in the middle of an ethics investigation. Then he went right through the revolving door to take a job at a lobbying firm founded by Corey Lewandowski. Under my bill to #EndCorruptionNow, this would be illegal. https://t.co/wpD1fGAgDp"
1096498107695673347,2019-02-15 19:54:55,"In her writing and art, Audre Lorde confronted racism, sexism, and violence. She spent her career advocating for communities of color and LGBTQ+ African Americans. Her words fill me with hope for the future: “Revolution is not a one-time event.” #BHM https://t.co/z163JjSfK5"
1096495707970854913,2019-02-15 19:45:23,RT @RAICESTEXAS: No. #FakeTrumpEmergency https://t.co/Cnvn0LnneR
1096481529063194626,2019-02-15 18:49:02,"RT @IndivisibleTeam: Trump just declared a #FAKENationalEmergency at the border. Trump is going around Congress, the will of the people, &amp;…"
1096476300351602691,2019-02-15 18:28:16,"I want to be absolutely clear: this ridiculous wall isn’t a national emergency, and Donald Trump isn’t king. We’ll fight this with everything we’ve got."
1096410113269739525,2019-02-15 14:05:15,Wow – this is fun. What would your version of my #UltraMillionaireTax look like? The top 0.1% need to start doing their part for the country that helped make them rich. https://t.co/sPVb0UetKs
1096230144187027456,2019-02-15 02:10:08,Bailey will be your valentine. https://t.co/afYGEX2W7I
1096198153735491584,2019-02-15 00:03:00,"There are about a zillion reasons why I love my sweetie Bruce, but I wanted to mention one: he’s always been my biggest supporter. Happy Valentine’s Day, Sweetie. I’m very lucky to have you by my side for all of life’s big adventures. https://t.co/DUzeHQy1Mp"
1096178487696805890,2019-02-14 22:44:52,Our kids are America’s future. I told the crowd in Iowa City: I’m fighting for a government in Washington that will invest in our children and our grandchildren. https://t.co/ftnqzmN1cX
1096170266714091520,2019-02-14 22:12:12,"Through arts education, Roxbury’s own Elma Lewis inspired people to realize the power of their voice – even when society was telling them they didn’t matter. #BlackHistoryMonth https://t.co/yWQbuHnfdj"
1096167499668836352,2019-02-14 22:01:12,I’m deeply disappointed that the Senate confirmed William Barr as US Attorney General. I’ll keep fighting to protect the Affordable Care Act and Roe v. Wade – and I’ll do everything I can to ensure that Special Counsel Mueller can do his job without interference. https://t.co/Vc92J9busZ
1096154077854158853,2019-02-14 21:07:52,"Gun violence is an emergency.
Climate change is an emergency.
Our country's opioid epidemic is an emergency.

Donald Trump's ridiculous wall is not an emergency."
1096152026050949123,2019-02-14 20:59:43,"I’m glad to hear that @DenverTeachers can go back to work with fair wages. When we fight, we win. https://t.co/erfSUgtAla"
1096139884631416832,2019-02-14 20:11:28,"My mother was born on February 14, and she loved her special connection to Valentine’s Day. Here’s how I remember her every year. https://t.co/hnQm8ANh9W"
1096133847010414594,2019-02-14 19:47:28,"I’m inspired by the young people who are leading the way, including the brave students from Parkland. If the grown-ups won’t act, they will. https://t.co/xBN11suXoK"
1096130376571990016,2019-02-14 19:33:41,"RT @PPact: Everyone deserves to lead a life that is healthy and free from violence. 

Why gun violence prevention is a public health issue…"
1096115943909085184,2019-02-14 18:36:20,".@Amazon – one of the wealthiest companies on the planet – just walked away from billions in taxpayer bribes, all because some elected officials in New York aren't sucking up to them enough. How long will we allow giant corporations to hold our democracy hostage? https://t.co/O9pz7en43B"
1096112255492599808,2019-02-14 18:21:41,I’m tired of hearing that we can’t afford things that address deep problems in our country. It’s just not true. We are the wealthiest nation in the history of the world – of course we can afford to invest in making sure every American has health care. https://t.co/d9PKlFjf49
1096076923934048256,2019-02-14 16:01:17,"RT @BarackObama: In the year since their friends were killed, the students of Parkland refused to settle for the way things are and marched…"
1096047295211151360,2019-02-14 14:03:33,"If we work together and demand action, we can prevent more avoidable deaths. Kids shouldn’t have to fear going to school, or be traumatized by lockdown drills, because of the absurd, corrupt reality of our gun laws. #ParklandStrong #GunReformNow https://t.co/qaFTorGUGt"
1096043005293805569,2019-02-14 13:46:30,"The @NRA has captured the @GOP. Republican politicians blocking any gun reform are choosing the promise of money, or the threat of withdrawing it, over protecting kids. It’s corrupt, and it’s a moral stain on every one of them. #GunReformNow"
1096042478447329280,2019-02-14 13:44:25,"There are so many common-sense gun reforms that Americans support. Just a few: 

✔️Ban assault weapons &amp; bump-stocks
✔️End the gun show loophole
✔️Prevent domestic abusers from legally obtaining guns

But 1 yr later, Congress hasn’t lifted a finger bc of plain, rancid corruption."
1096041316453093376,2019-02-14 13:39:47,"A year ago today, someone intent on doing harm was able to murder 17 students and teachers in Parkland because they had a military-grade gun. 

We grieve with victims’ families. And we fight alongside the Parkland students to fix our laws. #ParklandStrong"
1095889127743070208,2019-02-14 03:35:03,"Cedar Rapids – all I can say is, wow! This grassroots movement is about all of us fighting together, and after last weekend I know we’re off to a great start. https://t.co/mxogF7fpnc"
1095885731153743872,2019-02-14 03:21:33,I put the past 10 years of my federal tax returns online. And now I’m calling on every other candidate for President to do exactly the same thing. Add your name to our petition calling on all 2020 presidential candidates to put their taxes online. https://t.co/JshpM1FkQ3
1095876551357460480,2019-02-14 02:45:04,"Two years ago, I voted against @FEMA_Brock. Under his watch, our country’s response to #HurricaneMaria was a total failure. Then he used taxpayer money at @FEMA to pay for personal travel. It was corruption, plain and simple. I'm glad he's resigning"
1095794849872261128,2019-02-13 21:20:25,".@DenverTeachers’ fight is our fight. Every day, teachers open up new possibilities for their students. They deserve fair pay. #DenverTeachersStrike https://t.co/jdztiV6NvR"
1095779762084167680,2019-02-13 20:20:28,My #NoFirstUse bill is less than a page long. I believe it’s pretty simple: No President – Republican or Democrat – should start a nuclear war. https://t.co/MuY9nHCV47
1095752489104822272,2019-02-13 18:32:06,"Roger is a person of deep integrity, someone who always tells the truth and who never makes a promise that he doesn’t keep. I'm grateful and honored to have him in this fight. https://t.co/q2bQIRxxEC"
1095737879802925062,2019-02-13 17:34:03,"It’s not equal justice when a kid with an ounce of pot can get thrown in jail, while a bank executive who launders money for a drug cartel can get a bonus. We need reform. https://t.co/KqwPijHIz2"
1095709841505636352,2019-02-13 15:42:38,"Teachers spend years and years working hard and studying so they can do something good in the world. Obviously, this guy wouldn't know anything about that. https://t.co/aE0R8gDQLk"
1095701855303286784,2019-02-13 15:10:54,"This stinks like a pile of old fish. Under my bill to #EndCorruptionNow, a former lobbyist like David Bernhardt wouldn't be allowed to run the @Interior and pad the pockets of his former clients. https://t.co/ZrX8Z0qwoD"
1095519333701292032,2019-02-13 03:05:37,Running for President: that's what girls do. https://t.co/Lgmo0pF4LL
1095505941389369344,2019-02-13 02:12:24,This is what a first day on a presidential campaign looks like (in 30 seconds). https://t.co/S1LOZgtfmk
1095501564251377665,2019-02-13 01:55:01,"On Saturday in Lawrence, we came together – ready to raise our voices together until this fight is won. This is our moment in history, the moment we are called to. #Warren2020 https://t.co/ktPn9fQj07"
1095470755888926720,2019-02-12 23:52:35,"RT @MassEMA: If you must travel during #MAsnow this afternoon, clear snow off your vehicle, maintain a safe distance, take it slow, give yo…"
1095404433217933312,2019-02-12 19:29:03,"Unions built the middle class, and unions will rebuild the middle class. I had a great discussion with @238Teamsters about how we can level the playing field for workers in Davenport, Iowa and across the country. https://t.co/NOvy55TKKH"
1095377521749749762,2019-02-12 17:42:06,"Corruption is a cancer on our democracy. And we will only get rid of it with strong medicine – with real, structural reform. https://t.co/QLcatxCo3k #EndCorruptionNow"
1095343654426693634,2019-02-12 15:27:32,"They should be afraid. I want an economy that works for everyone, not just Wall Street bankers and their rich friends. And I believe top executives should go to jail when they break the law, just like anyone else. https://t.co/GA60N6c6yB"
1095314439283318784,2019-02-12 13:31:26,"The path to economic security is steep and rocky for millions of working people, and it is steeper and rockier for black and brown Americans. We won't be a party to perpetuating discrimination for another generation. This has to be called out. We need structural change. #BHM https://t.co/mfQs0EJz5a"
1095152611106398208,2019-02-12 02:48:24,I’m with @DenverTeachers all the way. I stand in solidarity with the teachers who are fighting to get the pay they deserve. #DenverTeacherStrike
1095127249936965632,2019-02-12 01:07:37,These guys make my heart happy. https://t.co/g8OK42DcKL
1095057892368179206,2019-02-11 20:32:01,"Everyone should have a shot at the American dream – and that means fighting for a #GreenNewDeal, #MedicareForAll, an #UltraMillionaireTax, and a whole lot more. Read my speech from Saturday if you haven’t already. https://t.co/NVpI77Fwel"
1095041200950837250,2019-02-11 19:25:41,"Thank you to everyone who joined us in Dover, NH on Saturday! We had a great conversation about how we can level the playing field for working people. https://t.co/4mGJfbMXcF"
1095002149581479936,2019-02-11 16:50:31,Facts! https://t.co/g2ByrsBDVF
1094986212161527810,2019-02-11 15:47:11,"Joycelyn Elders served as our country’s first African American Surgeon General. She grew up attending a segregated school, before joining the Army &amp; earning her MD. She is a groundbreaking advocate for women’s health &amp; access to health care. https://t.co/IJ7ITWQH4I #BHM"
1094956455910928384,2019-02-11 13:48:57,I just took a big step – I’m running for President. I’m deeply inspired by the energy of our grassroots movement and I’m ready for this fight. You can watch my entire speech here. https://t.co/GffCZANSSm
1094799229028089858,2019-02-11 03:24:11,"More than 300 people in Davenport, Iowa were willing to miss the first part of the #Grammys to talk about raising wages and strengthening unions. I love Iowa. https://t.co/t8dB4M4DjD"
1094773447337623552,2019-02-11 01:41:44,"Watch out, this one moves fast. SECOND selfie line of the day. Thank you, Iowa City! https://t.co/WuWJqA7zkP"
1094766578778980352,2019-02-11 01:14:26,"I was glad to meet so many energized people in Iowa City today. They were ready to dream big, fight hard, and win. And that’s exactly what we’re gonna do. https://t.co/b37gcieMzh"
1094750035542228998,2019-02-11 00:08:42,@IAStartingLine Just reading some tweets in the car. https://t.co/SO9ezBbrG1
1094693471254970369,2019-02-10 20:23:56,"Thanks to the hundreds who braved the snow in Cedar Rapids, Iowa this morning! #Warren2020 https://t.co/cla0OC7K70"
1094686092392054784,2019-02-10 19:54:37,"First full day as a presidential candidate – first selfie line as one. Thank you, Cedar Rapids! https://t.co/rIhftlNAjw"
1094679490616270848,2019-02-10 19:28:23,"Yesterday I made a big announcement: I’m running for President. Our fight is for big, structural change – and this is the fight of our lives. I hope you'll join us. https://t.co/sU5kpwUiOg"
1094658363718287361,2019-02-10 18:04:26,"Billionaire CEOs can’t shut us up. Donald Trump can’t shut us up. The GOP can’t shut us up. Here’s what I say to them: We’re just getting started. 

We’re building a grassroots movement to level the playing field. Sign up &amp; be a part of this. https://t.co/OzK6wseYqp"
1094618588718223360,2019-02-10 15:26:23,"Melnea Cass, the “First Lady of Roxbury,"" was a beloved leader of MA's civil rights fight – registering voters, protesting racist hiring practices, fighting education inequality, &amp; leading the @BostonNAACP1911. https://t.co/V9DTTDTsUO #BlackHistoryMonth"
1094405402043867136,2019-02-10 01:19:15,I’m deeply grateful for everyone who made our announcement in Lawrence so incredible. This grassroots movement will put power back in the hands of the people – where it belongs. https://t.co/I3yRddj74B
1094371260027539456,2019-02-09 23:03:35,"We had a terrific crowd of people in Dover, NH who are ready to get organized, build a movement, and make big, structural change. https://t.co/sCF0qypE6q"
1094326523853791232,2019-02-09 20:05:49,"This campaign is fueled by small donors and people ready to roll up their sleeves and get in this fight. Lauren is one of those people, and I got to surprise her in Dover today. https://t.co/rfFmbfScTI"
1094293914373275655,2019-02-09 17:56:14,"We fight side by side, and that’s how we’ll make big, structural change. Here’s my full speech from today in Lawrence: https://t.co/NVpI77Fwel #Warren2020"
1094292587530338306,2019-02-09 17:50:58,"Thank you, Lawrence – and thank you all for being a part of this special day! Let's dream big, fight hard, and get to work to build a future for all of our kids. #Warren2020 https://t.co/APNzcXOPXw"
1094290240200761349,2019-02-09 17:41:38,"We're building a grassroots movement to give the power back to the people. We're dreaming big, fighting hard – and we're just getting started. #Warren2020 https://t.co/q1mV4RSS2X"
1094288947826565120,2019-02-09 17:36:30,"I believe in an America of opportunity. My daddy ended up as a janitor, but his little girl got the chance to be a public school teacher, a college professor, a United States Senator – and a candidate for President of the United States. #Warren2020 https://t.co/F6CwKGhK9C"
1094288444719841280,2019-02-09 17:34:30,People said it would be “too hard” to build the @CFPB and stop big banks from cheating Americans. They said it would be “too hard” for a woman Senator to be elected in MA. They were wrong. #Warren2020 https://t.co/pcgHRiGzYR
