id,created_at,text
1054149727581806593,2018-10-21 23:17:34,"States like MA should be free to adopt their own laws on marijuana, without the federal government interfering. Elizabeth Warren is working on a bipartisan bill to protect state, territory, and tribal rights. https://t.co/TaHBpy8FjP #WGBYDebate"
1054148069611200512,2018-10-21 23:10:59,Elizabeth Warren was proud to #march4ourlives with students in Springfield. Congress shouldn’t work for the NRA. We must pass common-sense gun reform to keep our kids safe in our schools and on our streets. #WGBYDebate https://t.co/QvjxBR9Zql
1054147150542704646,2018-10-21 23:07:20,"Offshore drilling in MA would endanger shipping in Boston, fishing from Gloucester to New Bedford, &amp; tourism &amp; small businesses on the Cape &amp; Islands. Elizabeth Warren is fighting to stop the Trump administration from surrendering to Big Oil. #WGBYDebate https://t.co/KQpfuWCxm3"
1054145012693434368,2018-10-21 22:58:50,Tonight we’re in Springfield for our second debate! Stay tuned here in just a few minutes for live updates from our campaign team. #WGBYDebate
1054141396536442880,2018-10-21 22:44:28,This is what a grassroots army looks like. #WGBYdebate https://t.co/Udn1Sv70UN
1054140738492080136,2018-10-21 22:41:51,Fired up and ready for #WGBYdebate! https://t.co/pPqAx6FYgR
1054130463659438080,2018-10-21 22:01:01,Woo-hoo! Tonight is the second debate of our re-election campaign – and there’s a lot of energy here in Springfield. https://t.co/BMCmG0Slq5
1054034396603392000,2018-10-21 15:39:17,The race for #IL13 was always close. But now @BetsyForIL is just 1 point away from the GOP incumbent – wow. Betsy is a health care champion &amp; we need her in the House. Pitch in whatever you can now to give her the momentum she needs to win: https://t.co/iF2UrkmF6I https://t.co/mp22y8bfQ4
1054014764102242305,2018-10-21 14:21:17,Saudi Arabia murdered a journalist. @realDonaldTrump is trying to help them cover it up. Why? Is it because he cares more about stuffing his own pockets with their cash than he does about a free &amp; independent press? https://t.co/WZbhljndvO
1053702561994342401,2018-10-20 17:40:42,But here's the deal: Gary @TraunerforWY only needs 100K votes to flip the Wyoming Senate seat to a Democrat. I know Gary has what it takes to win on November 6 – but he needs help to keep the momentum up. Donate directly to Gary Trauner's campaign: https://t.co/6gcuMa6f5G #wysen
1053702560165646336,2018-10-20 17:40:41,"Gary @TraunerforWY's Senate race in Wyoming is tightening up. We don't agree on everything, but I know he'll be a strong voice for WY working families. Meanwhile, his GOP opponent John Barrasso voted to repeal the ACA &amp; give tax breaks to billionaires."
1053692039924248576,2018-10-20 16:58:53,This is appalling. @ComericaBank bungled a security breach that allowed fraudsters to steal Social Security payments from some of our most vulnerable citizens. I want answers. https://t.co/6vL5zPUQRi
1053668098975432704,2018-10-20 15:23:45,We know who @Abby4Iowa is. She's a fighter for Iowa working families &amp; she won't be bullied by anyone (least of all by @realDonaldTrump). And we know she has what it takes to win #IA01 on Nov 6. Donate directly to Abby's campaign and let's make it happen: https://t.co/0jCT5VKBKA https://t.co/NZy0g5dj5x
1053462925057257472,2018-10-20 01:48:28,"Our first debate just ended, and one thing is very clear: If Massachusetts sends my opponent to the Senate this November, he will be nothing but a rubber-stamp for @realDonaldTrump and his corrupt agenda. #WBZDebate https://t.co/4133UWFsq6"
1053447710534258688,2018-10-20 00:48:00,"Elizabeth Warren went to McAllen, TX to find out what was happening to immigrant families ripped apart by the Trump administration. Here’s what she saw. https://t.co/wjhvO1y9vY #WBZDebate"
1053447366991364096,2018-10-20 00:46:39,Our diversity makes our country strong. It’s long past time for help Congress to help our Dreamers &amp; pass comprehensive immigration reform that protects our borders &amp; creates a path to citizenship. #WBZDebate
1053446283850080256,2018-10-20 00:42:20,"The majority of Americans – Democrats, Republicans, Independents – support common-sense gun safety rules. The GOP majority is working for the NRA, not our children. Thoughts and prayers are not enough – we need action. #WBZDebate"
1053444187662770176,2018-10-20 00:34:01,"We’re proud that MA has led the nation in protecting &amp; promoting equality, but our country must do more - pass the Equality Act to ban discrimination against LGBTQ people, protect transgender rights, &amp; resist Trump’s efforts to roll back our progress. #YesOn3 #WBZDebate"
1053442548059004928,2018-10-20 00:27:30,"Massachusetts has some of the very best doctors, researchers &amp; innovators in the world. Elizabeth Warren has fought to increase our NIH budget &amp; helped secure an extra $2 billion in medical research funding last year. https://t.co/SHQV1LCbRc #WBZDebate"
1053441233056608258,2018-10-20 00:22:16,The Anti-Corruption Act that Elizabeth Warren is fighting for would require @realDonaldTrump – and all candidates for federal office – to release their tax returns. Learn more about it here. https://t.co/Aa1zvPtd3F #WBZDebate
1053440776515043329,2018-10-20 00:20:27,"As part of her commitment to transparency and anti-corruption, Elizabeth Warren released 10 years of tax returns. https://t.co/aGIbLVCKZ2 #WBZDebate"
1053439016794841089,2018-10-20 00:13:28,Massachusetts small businesses aren’t hiding their money in the Cayman Islands or exploiting tax loopholes to ship jobs overseas. We need to make our tax system fairer so small businesses can compete with the big guys. #WBZDebate
1053438325493784576,2018-10-20 00:10:43,"Now that the GOP tax scam for billionaires &amp; giant corporations has caused our deficit to explode, the GOP is saying “Sorry!” – no money for Medicare, Medicaid, Social Security. The rich &amp; powerful need to pay their fair share. #WBZDebate"
1053438180387643392,2018-10-20 00:10:08,"The GOP tax scam was a $1.5 trillion giveaway to billionaires &amp; giant corporations. We believe the biggest, richest, most powerful corporations in America should pay their fair share, so we can make the investments we need to keep our economy &amp; our country strong. #WBZDebate"
1053434693255880706,2018-10-19 23:56:17,Tonight is our first debate – and I'm ready to talk about how I'm fighting to level the playing field for MA families &amp; hold @realDonaldTrump accountable. Stay tuned here for live updates from our campaign team! #WBZDebate
1053419547259297793,2018-10-19 22:56:06,Tonight is our first debate and I’m just about to head into the studio. Thanks to everyone who came out in person! https://t.co/JEQaCeTQIY
1053353637504864257,2018-10-19 18:34:12,"Mitch McConnell &amp; the Republicans will bend over backwards to give @realDonaldTrump &amp; his corrupt administration a pass. 

But we’re not ignoring it – not today, and not in 18 days from now. Tick, tock. https://t.co/MTBEX2DPBo #EndCorruptionNow"
1053328034391080960,2018-10-19 16:52:27,"US infrastructure is broken. But @HaleyLive helped save the auto industry – &amp; if we elect her to Congress on Nov 6, she’ll fight to invest in America’s crumbling infrastructure so we can build safer roads &amp; bridges. Chip in &amp; let's flip #MI11 blue: https://t.co/U23TtPY1Go https://t.co/CmAgtxDaqn"
1053314056914911232,2018-10-19 15:56:55,"Sheldon Adelson is a casino tycoon &amp; 1 of Trump’s billionaire buddies. He donated $20M to Trump in 2016. Now President Trump is lobbying the Japanese gov to let Adelson open a huge casino there. You’re not fooling anyone, @realDonaldTrump #EndCorruptionNow https://t.co/KJisMOOfGN"
1053288488580263936,2018-10-19 14:15:19,"For decades, rules created by the federal govt blocked African American families from buying homes &amp; building wealth through a process called 'redlining’. My new housing bill would help bring down costs for renters &amp; buyers in communities of color across the country. https://t.co/b6aOiEf7V4"
1053273594216804352,2018-10-19 13:16:08,"Michelle Lujan Grisham's opponent for New Mexico governor spread Obama birther conspiracy theories &amp; wrote that a wife should ""voluntarily submit"" to her husband. Time to draw a line in the sand. Pitch in &amp; let's help @Michelle4NM win this seat: https://t.co/d7WGRbp8iz"
1053129589726285824,2018-10-19 03:43:55,Woo-hoo @RedSox!!! #DoDamage
1053101948864475139,2018-10-19 01:54:04,"10/17: @realDonaldTrump says he is too ""busy"" to visit American soldiers in Iraq and Afghanistan.

10/18: @realDonaldTrump once again spewing bile at campaign rallies.

It's not time. It's priorities.

https://t.co/gCbBWHGrnL"
1053075042655985664,2018-10-19 00:07:10,"Let’s be clear: Massachusetts doesn’t need @realDonaldTrump’s #1 ally in the Senate to go along with @mike_pence’s extreme anti-woman, anti-LGBTQ+ agenda. Take a stand &amp; get in this fight with us: https://t.co/p0m0HfPPVl"
1053074238733611008,2018-10-19 00:03:58,"That’s right, my opponent is proud of his endorsement by @mike_pence, who:
 ✔️Tried to defund @PPFA  
 ✔️Suggested marriage equality would lead to “societal collapse”
 ✔️Signed radical anti-abortion laws
 ✔️Tried to redefine rape to “forcible rape” for federal funding of abortion"
1053073221019426816,2018-10-18 23:59:55,"Surprise, surprise: Vice President @mike_pence just endorsed our GOP opponent &amp; called him a “rock-solid conservative with a tremendous record.” And guess what? Geoff Diehl is proud to have Pence’s support. https://t.co/tk0zOG2GLp"
1053040671257440261,2018-10-18 21:50:35,Nobody should have to live 1 family emergency away from financial disaster. Help Molly Kelly fight back in NH: https://t.co/daUzsG3Xkp https://t.co/nlVxYDjKdh
1053028318910586880,2018-10-18 21:01:30,I’ll just be blunt: repealing the ACA is at the top of the Republicans’ to-do list next year. Voting in the midterm elections is powerfully important. Make sure you’re all signed up &amp; ready to go on Election Day: https://t.co/gqxIsZ310M https://t.co/9Gp1YTchSF
1052974974183583745,2018-10-18 17:29:31,The GOP is SCARED. That’s why they’re attacking Antonio Delgado – a terrific candidate for #NY19 – with racist ads. But Antonio is a proven leader &amp; fighter for NY families. He won't be bullied by anyone. Help @DelgadoforNY19 win &amp; donate to his campaign: https://t.co/liktD2nxWJ
1052940663724154887,2018-10-18 15:13:11,"Surprise, surprise: @SecretaryZinke’s very first meetings as head of the Dept of the @Interior were with the @NRA &amp; a mining CEO – but they’re missing from his calendar.

What else are you hiding, @SecretaryZinke? #EndCorruptionNow https://t.co/bJs4dc6BLF"
1052922850464727046,2018-10-18 14:02:24,"Don’t forget: Early voting in Massachusetts starts on Monday, October 22! Make a plan right now to early vote: https://t.co/vliH24FD0g #gotv #teamwarrenearlyvotes"
1052916615409352704,2018-10-18 13:37:38,Saudi Arabia has spent millions lobbying Washington &amp; bailing out @realDonaldTrump. It's no surprise that his team won't stand up to it. My anti-corruption bill would force presidents to release their taxes &amp; ban lobbying on behalf of foreign govts. Congress should pass it now. https://t.co/CYFO6CDz3d
1052904045709537280,2018-10-18 12:47:41,Our government works great for the guys at the top – while workers &amp; families get left in the cold. That's why @AnitaMalik fights for good-paying jobs &amp; our economy. Let's help her win #AZ06 so she can head to the House &amp; level the playing field: https://t.co/84L6lGOOwN https://t.co/GQTvAvVhFC
1052696308295852032,2018-10-17 23:02:12,"All his life, @realDonaldTrump has relied on his rich buddies to bail him out. Now, one of his biggest donors is writing big, fat checks to help Trump associates under investigation by Robert Mueller. #EndCorruptionNow https://t.co/80DKNakWVo"
1052671570643247104,2018-10-17 21:23:54,Woo-hoo! @TinaSmithMN is up in the polls. But let's be clear: we can't take ANYTHING for granted in Minnesota with just 20 days until Election Day. Chip in whatever you can afford to help Tina keep the momentum up &amp; protect this Senate seat: https://t.co/KDEK15zVti #mnsen
1052640442913828864,2018-10-17 19:20:13,"For years, the GOP have whined about the deficit. Then late last year, they exploded it with their $1.5 trillion #GOPTaxScam.

Now they say – Sorry! There’s no money left for Social Security &amp; Medicare, let’s slash them.

We’re not falling for it. https://t.co/KklhEMLuqw"
1052596051583139841,2018-10-17 16:23:49,🚨 MASSACHUSETTS! 🚨 Today is the deadline to register to vote! Don't forget to sign up today – or double (&amp; triple check!) your registration here: https://t.co/8zeFjrVOf2
1052581608778358784,2018-10-17 15:26:26,"RT @PPAdvocacyMA: 🗳️🚨🗳️🚨🗳️🚨🗳️🚨

Register to defend reproductive rights.
Register to protect health care access.
Register to stand up for co…"
1052559369408339968,2018-10-17 13:58:03,"RT @massdems: We're #TogetherForNovember, and that includes voters across Massachusetts. 

This election is too important to sit out. The r…"
1052551062761197573,2018-10-17 13:25:03,"The GOP are dumping loads of dark money on ads attacking the patriotism of Iraq War vet @danielfeehan, a real fighter for working families who I know can win #MN01. Please pitch in whatever you can afford, and let’s show Dan that we have his back. https://t.co/cx2IGPwl3j https://t.co/E20dfi37G4"
1052367728458121216,2018-10-17 01:16:33,"For decades, the Saudis have bailed out @realDonaldTrump from his lousy real estate deals. Who are you really working for @realDonaldTrump? https://t.co/ouRQsq5PwD"
1052324682437943301,2018-10-16 22:25:30,"We have a real shot at taking back the House in November – and I know 3 terrific veterans who are leading the way. @MikieSherrill, @GinaOrtizJones, &amp; @GilCisnerosCA will advocate for other veterans &amp; stand up for @DeptVetAffairs. Let's help them out: https://t.co/L7Kytqg88K"
1052304604141166592,2018-10-16 21:05:43,"RT @VotingInMass: The last day to register to vote is TOMORROW.

Register online at https://t.co/CHTzRPjHfj.

Don't have a Mass ID? Print o…"
1052303627396755461,2018-10-16 21:01:50,RT @MAYoungDems: Three weeks away! #mapoli #BlueWave2018 https://t.co/HKKyvS7CA3
1052277915151454209,2018-10-16 19:19:40,There are only three weekends between today &amp; the most important midterm election of our lifetimes. Be a part of this fight – join our team at a local event to support our re-election campaign &amp; help elect Massachusetts Democrats up and down the ballot. https://t.co/NiCxNcaMT4
1052199494207590400,2018-10-16 14:08:02,"Tomorrow’s the last day to register to vote in MA! Please don’t miss your chance to make your voice heard. Start here, or double-check to be 100% sure that you’re registered at the right address: https://t.co/8zeFjrVOf2"
1052188087206510592,2018-10-16 13:22:43,"In the meantime, thank you to everyone who donated to NIWRC yesterday. For anyone who hasn't had a chance to check out their important work fighting violence against Native women, here's that link again. @realDonaldTrump won't help – but we can. https://t.co/QWGtEknsN4"
1052185536880873473,2018-10-16 13:12:35,"Millions of people watched you, @realDonaldTrump, as you fumbled and lied on your $1 million pledge. It then took a day for your handlers to tee up this recycled racist name-calling. You’ve lost a step, and in 21 days, you’re going to lose Congress."
1051975265767870464,2018-10-15 23:17:02,"Tick-tock, @realDonaldTrump. November 6th is coming."
1051974806848065538,2018-10-15 23:15:13,"Yeah, @realDonaldTrump will keep insulting me. Let him. We’ll be busy registering voters, knocking on doors, making sure our neighbors know the facts, &amp; telling them about what we're ready to do to build pride, hope, &amp; opportunity all across our country. https://t.co/sb2oPItfwS"
1051974359068348417,2018-10-15 23:13:26,"And on November 6, if you’re tired of getting scammed by your President, stand with me, and with the reformers on the ballot in your community, and let’s elect new leadership so we can start getting things back on track in Washington."
1051973629959913472,2018-10-15 23:10:32,"At the end of the day, I trust the people of Massachusetts to look at the facts about who I am and how I've lived my life and make their own judgment about me. But remember: @realDonaldTrump doesn't have the same kind of faith in you."
1051973165516242944,2018-10-15 23:08:42,"But to do that, we’ve got to work as hard as we can between now and November 6 to tune out the lies, ignore the chaos, shrug off the fake bluster, and focus on organizing for REAL change."
1051972598794526721,2018-10-15 23:06:26,"I’m ready to reverse the trillion-dollar tax scam and use that money to help cut student loan debt and rebuild infrastructure, ready to stand WITH our allies AGAINST our enemies, and get to work on clean energy, immigration reform, and gun safety."
1051972010094546944,2018-10-15 23:04:06,I’m ready to support working people and help middle class families build real security. I’m ready to root out corruption and clean up Washington. I’m ready to stop the politics of hatred and division so we can bring back core American values like diversity and respect.
1051971618069712896,2018-10-15 23:02:33,"Like I promised @NCAI1944 in February, whenever someone brings up my family story, I’ll use it to lift up the story of Native families and communities. I'll use it today to lift up the NIWRC and their amazing work to protect Native women from violence. https://t.co/DyHTeIU4uo"
1051970678155563008,2018-10-15 22:58:48,But nicknames don’t help families pay for child care. Conspiracy theories won’t solve climate change. Racial slurs can’t raise wages or make our communities safer.
1051970049139990528,2018-10-15 22:56:19,"Here's the deal: @realDonaldTrump’s Washington is more corrupt &amp; more out of touch than ever. And it turns out @realDonaldTrump never had any plan to make things better, &amp; he has no plan now. All he can offer are attacks &amp; distractions."
1051969479121494019,2018-10-15 22:54:03,"And @realDonaldTrump should be scared – because on November 6, we’re going to bust up that con once and for all."
1051968900290793472,2018-10-15 22:51:45,And you know what scares him the most? Us. The American people. He’s afraid we’ll see him for who he really is and expose the con he’s been running on our country from Day One.
1051968284990611457,2018-10-15 22:49:18,"He’s afraid to stand up to Vladimir Putin in defense of our country, afraid to talk to Robert Mueller because he knows he'll crack under the pressure, and so afraid to go out in public, he hides out at his own golf clubs."
1051967674618662914,2018-10-15 22:46:52,"Oh, and one more thing. @realDonaldTrump likes to pretend he’s a real tough guy. But like most bullies, he sure scares easy, doesn’t he?"
1051967056403419141,2018-10-15 22:44:25,"And @realDonaldTrump loves playing the strong, decisive leader – but look at the chaos on his own staff, the way his administration fumbled the Puerto Rico recovery, or how he constantly undermines his own agenda with his own incompetence."
1051966419091542017,2018-10-15 22:41:53,"He drapes himself in the flag – but for all his talk about ""Making America Great Again,"" all @realDonaldTrump does is attack our core values (the free press, the democratic process, our legacy of diversity) while he shovels taxpayer cash into his own pockets."
1051965864138952704,2018-10-15 22:39:41,"He demands military parades in his honor but cheats our veterans out of charitable donations, attacks their families, ducked out of Vietnam, &amp; can't even be bothered to visit the troops that he refuses to bring home from Afghanistan or Iraq."
1051965241498750976,2018-10-15 22:37:12,"He pretends to love law enforcement – but attacks his own Justice Dept, attacks the American hero who led the FBI after 9/11 for doing his job, &amp; stuffs his Admin with crooks who bend over backwards to make sure no CEO ever goes to jail for cheating people."
1051964622390157312,2018-10-15 22:34:45,"He promised to #draintheswamp – but @realDonaldTrump is the most corrupt President in American history. The long line of scandals &amp; convictions (Pruitt, Price, Manafort, Cohen, etc.) prove it. Art of the Deal? More like Art of the Plea Deal."
1051964000072847366,2018-10-15 22:32:16,He pretends he’s a populist – but @realDonaldTrump’s economic policies are all about making the rich richer and the powerful more powerful. He’s stuffed his administration with so many former Goldman Sachs bankers they could open a branch office.
1051963270746263552,2018-10-15 22:29:22,"We knew all that before @realDonaldTrump became President. But since he took office, we’ve learned that the scam runs even deeper."
1051962399362813953,2018-10-15 22:25:55,"And @realDonaldTrump brags about being a successful businessman – but he’s only good at going bust (he even lost money with a casino!) and cheating people: scamming Trump U students, shortchanging workers and contractors, &amp; abusing bankruptcy laws to save his own skin."
1051961361754918914,2018-10-15 22:21:47,"For starters, @realDonaldTrump wants us to think he’s a billionaire – but he won’t show us his tax returns. Why? Maybe he isn’t as rich as he pretends, &amp; he doesn’t want us to know that his ""empire"" is really built on debts he owes to some sketchy characters."
1051960348075540481,2018-10-15 22:17:46,"If @realDonaldTrump – a cowardly elitist who has never known or cared what life is like for anyone who's ever lived outside of a skyscraper in Manhattan – wants to talk about authenticity, well then, let's talk about who's REALLY pretending to be someone they're not."
1051959822189510662,2018-10-15 22:15:40,"Speaking of family stories, @realDonaldTrump has one, too. It's the story of a second-generation tax cheat who was handed a $413 million inheritance through rich-guy loopholes and outright criminal fraud. https://t.co/ZHJIm4GQG3"
1051958376052211713,2018-10-15 22:09:55,"I won't sit quietly for @realDonaldTrump's racism, so I took a test. But DNA &amp; family history has nothing to do with tribal affiliation or citizenship, which is determined only – only – by Tribal Nations. I respect the distinction, &amp; don't list myself as Native in the Senate."
1051956431526744065,2018-10-15 22:02:12,"Bottom line: My heritage played no role in my hiring – ever. The @BostonGlobe reviewed all the evidence. Their verdict? ""At every step of her remarkable rise in the legal profession, the people responsible for hiring her saw her as a white woman."" https://t.co/LTQ6d1sMwM"
1051955849927712768,2018-10-15 21:59:53,"We all know why @realDonaldTrump makes creepy physical threats about me, right? He’s scared. He’s trying to do what he always does to women who scare him: call us names, attack us personally, shrink us down to feel better about himself. It may soothe his ego – but it won’t work. https://t.co/2rfPSlvlQA"
1051934086003085313,2018-10-15 20:33:24,We’re only two days away from the deadline to register to vote in Massachusetts! Double-check that you’re registered or start the process here: https://t.co/KBoo5Q3iQz https://t.co/4FW0jV2prs
1051861713589432320,2018-10-15 15:45:49,"Having some memory problems, @realDonaldTrump? Should we call for a doctor?

Here’s something you won’t “forget,” Mr. President: You’re the least popular president in modern history &amp; your allies will go down hard in the midterm elections. 22 days. Tick-tock, tick-tock. https://t.co/53FV0HXGXX"
1051821406240018432,2018-10-15 13:05:39,"I took this test and released the results for anyone who cares to see because I’ve got nothing to hide. What are YOU hiding, @realDonaldTrump? Release your tax returns – or the Democratic-led House will do it for you soon enough. Tick-tock, Mr President."
1051821191470751745,2018-10-15 13:04:48,"NIWRC is a nonprofit working to protect Native women from violence. More than half of all Native women have experienced sexual violence, and the majority of violent crimes against Native Americans are perpetrated by non-Natives.
   
Send them your $1M check, @realDonaldTrump."
1051820933982359553,2018-10-15 13:03:47,"By the way, @realDonaldTrump: Remember saying on 7/5 that you’d give $1M to a charity of my choice if my DNA showed Native American ancestry? I remember – and here's the verdict. Please send the check to the National Indigenous Women’s Resource Center: https://t.co/I6YQ9hf7Tv https://t.co/J4gBamaeeo"
1051784166294126592,2018-10-15 10:37:41,"I never expected my family’s story to be used as a racist political joke, but I don’t take any fight lying down. I want you to have the power to fight lies with the truth, so here's a new site for you to review every document for yourself. https://t.co/900SsAMNjb"
1051783851469627392,2018-10-15 10:36:26,"I get it: @realDonaldTrump is afraid of facts. But I’m not. And the facts are clear. A deep, independent investigation shows my background played no role in any job I got. https://t.co/LTQ6d1sMwM"
1051783184390664192,2018-10-15 10:33:47,"My family (including Fox News-watchers) sat together and talked about what they think of @realDonaldTrump’s attacks on our heritage. And yes, a famous geneticist analyzed my DNA and concluded that it contains Native American ancestry. https://t.co/r3SNzP22f8"
