id,created_at,text
1121152173029691392,2019-04-24 20:41:22,The evidence all points in the same direction. The mistreatment of Black and Brown women around maternal health is the direct result of institutional and structural racism. We need bold solutions to the epidemic of maternal mortality in America. #SheThePeople
1121152171658158081,2019-04-24 20:41:22,"Moms in our country are dying from childbirth at rates almost 40% higher than in other wealthy countries—and the Black maternal mortality rate is 3-4 times higher than it is for white moms, across all income levels. We have to call it out. #SheThePeople"
1121152170362011654,2019-04-24 20:41:22,"The treatment of women and infants is a direct reflection of the values of a society—and the U.S. has the worst maternal mortality rate in the developed world. It's a national disgrace. Today, I talked about my idea to fix it. #SheThePeople"
1121129021830586369,2019-04-24 19:09:23,"Student loan debt is holding back an entire generation and crushing families—but we can change that. José María, Eva, Jayme, Alexandria, Tasha, Alicia, and Michael have big plans for what they could do if we cancel their debt. https://t.co/3hKnKbRYvo"
1121124507375341568,2019-04-24 18:51:26,We need to start fixing our higher education system so it better serves everyone—including communities of color. That's why my plan invests a minimum of $50 billion in HBCUs and Minority-Serving Institutions (MSIs). https://t.co/SL1ruAVWXa
1121113765104246784,2019-04-24 18:08:45,I’m grateful for the conversations we had in Keene and Weare last weekend about the future of our country. We're going to do this together! https://t.co/e0y23QkEzg
1121101573948682241,2019-04-24 17:20:18,"RT @commondefense: Something you may not have noticed about @ewarren's bold education plan: she's taking a stand for Veterans.

Warren woul…"
1121092451899518976,2019-04-24 16:44:04,"We need to act on climate change before it’s too late. That’s why I’m making a promise. On the first day of a Warren administration, I’ll sign a total moratorium on all new fossil fuel leases, including for drilling offshore and on public lands. https://t.co/mL6NCf6f9R"
1121085222903341056,2019-04-24 16:15:20,"We won’t go back on women’s health—not now, not ever. The Trump administration's gag rule is immoral, dangerous, and illegal. Period. #ProtectX https://t.co/w1fUPL4VJa"
1121080095446327296,2019-04-24 15:54:58,"Go, Jane! https://t.co/79UKfHIQBs"
1121045783749562370,2019-04-24 13:38:37,It was great meeting Ricardo at @AllenUniv in South Carolina yesterday. I’m grateful that young people like him are in this fight all the way to cancel debt for 95% of Americans and make public colleges free. https://t.co/nLp7WQekop
1120867005941334022,2019-04-24 01:48:13,"Young people in our country, like Aubrey from Utah, are getting absolutely crushed by student loan debt. It doesn’t have to be this way and I’ve got a plan to tackle the debt crisis head on. https://t.co/6wXX93xmd0"
1120864949629222917,2019-04-24 01:40:03,"RT @Seawolf308: @ewarren I am a Navy veteran, with $50,000 in student loan debts.  I often struggle with work because of chronic pain from…"
1120862171355865089,2019-04-24 01:29:00,"RT @mminthecity: if this plan goes into effect, i would only have to pay back $12-15K, which i can thankfully do in one year, and have done…"
1120856618743271425,2019-04-24 01:06:57,"I want every girl to grow up knowing that they can fight from the heart—and that they can win. So when I meet a little girl on the campaign trail, I say: “I’m running for president, because that’s what girls do.” And we pinky promise that they’ll remember. https://t.co/Wke6KYZ4Tw"
1120847140740304901,2019-04-24 00:29:17,"When Amazon can tilt the online marketplace in its own favor, small businesses see an immediate impact in their profits. That can be absolutely crushing, it's not fair, and I’m fighting to end that. https://t.co/eV2ZvHuzJT"
1120847139557580800,2019-04-24 00:29:17,"Finally, I said that Amazon was about 49% of all online retail sales. And yes, you are. What an odd thing to deliberately misconstrue. https://t.co/uvRgq1tI77"
1120847137149833217,2019-04-24 00:29:16,"Second, Amazon's private label products are projected to reach $25 billion in online sales by 2022. An analyst said huge private label sales would give Amazon ""a strong...competitive advantage"": https://t.co/P8zgrSdxHC"
1120847134859956227,2019-04-24 00:29:15,"Oh boy. Here are the facts:
First, there are multiple reports that Amazon is using the data it collects to copy successful goods sold by small businesses on the Amazon Marketplace and sell its own branded version. https://t.co/x6LklklPPQ https://t.co/owUdVGgI6F"
1120803805430472705,2019-04-23 21:37:05,"Let’s be clear: Our #2020census must count every single person. Our Constitution demands it, and our democracy requires it. https://t.co/JutmPigUcw"
1120799413637648388,2019-04-23 21:19:38,"My new plan for the cancellation of student loan debt applies to public technical schools, too. Wherever you pursue an education, you should be able to graduate without getting crushed by piles of debt. https://t.co/LmOI8jPipa"
1120790350698811393,2019-04-23 20:43:37,"Thanks, @NHYoungDems. I’m grateful for the work you do on this issue, including pushing NH to restore funding for public universities. https://t.co/1kTYxkzdSI"
1120785073824051205,2019-04-23 20:22:39,RT @IAforWarren: Want to know more about @ewarren's plan for student debt relief and tuition-free public college? Read all about it in toda…
1120780791892647936,2019-04-23 20:05:38,"You've got to pay something back so that everyone can have a chance. A 2% tax on the wealthiest fortunes can let us provide universal Pre-K, universal free college, cancel student loan debt for 95% of Americans—and still have a trillion dollars left over. #WarrenTownHall https://t.co/3lHR01OpgZ"
1120770294476615683,2019-04-23 19:23:55,"I was grateful to be at @AllenUniv this morning, where we talked about how we can level the playing field for all our students—not just a select few. My new college debt plan would establish a minimum of $50 billion for HBCUs and Minority-Serving Institutions. https://t.co/Jku9TMF6Ot"
1120757273356394497,2019-04-23 18:32:11,"We can make big, structural change—as long as we build a grassroots movement to fight for it. Add your name to say you support cancelling up to $50,000 in student loan debt for 42 million Americans and making universal free public college a reality. https://t.co/4fB3xHZsQJ"
1120747473419558919,2019-04-23 17:53:14,"Our government needs to do right by Americans getting crushed by debt—including you, Sarah. I’m in this fight to end the student debt crisis all the way. https://t.co/NuP1FVe7wI"
1120741348888412162,2019-04-23 17:28:54,"I know we can make real, structural change for students like you, Olyvia. That’s what my new plan is all about. https://t.co/ruzUEqFdwo"
1120731608687030272,2019-04-23 16:50:12,Woo-hoo! Massachusetts and I are really lucky to have @RogerLau. https://t.co/bHWM9ZTlTv
1120700848714203136,2019-04-23 14:47:58,"Do you have a story about student loan debt and college affordability? How would this plan change your life? If this plan would be personally meaningful for you or someone you know, raise your voice and tell your story with #CancelMyDebt. https://t.co/2D4fl2hjoN https://t.co/fLefZJlZZJ"
1120700847879532545,2019-04-23 14:47:58,"My new plan would cancel up to $50,000 in student loan debt for 42 million Americans, and completely wipe out student loan debt for more than 75% of Americans. This would free an entire generation of families from crushing debt and give our economy a boost."
1120677751227408385,2019-04-23 13:16:11,Even better: I want to establish a *minimum* of $50 billion for HBCUs &amp; Minority-Serving Institutions (MSIs)! The Secretary of Ed. would increase the amount of money in the fund as needed to ensure that spending per-student at these schools is comparable to colleges in the area. https://t.co/0POeNWr4ID
1120530921176862720,2019-04-23 03:32:44,This is personal because policy touches the lives of everyone in this country. Thanks for tuning in! #WarrenTownHall https://t.co/iig66y7bIY
1120528821571264512,2019-04-23 03:24:24,Wow! Thanks for watching. We’re in this fight together. https://t.co/3h8u5BqCd7
1120526854790746124,2019-04-23 03:16:35,"RT @LCVoters: We shouldn't even need to say this, but we agree @ewarren, ""No coal lobbyists for head of the EPA."" #ChangeTheClimate2020 #Wa…"
1120525455503785984,2019-04-23 03:11:01,"I’m so grateful you tuned in, Zerlina. https://t.co/LYBHcEfyQt"
1120518404526489602,2019-04-23 02:43:00,"Climate change is real and it is here. We just can’t wait any longer. It’s all hands on deck, and we’ve got to make change—starting with a  #GreenNewDeal. #WarrenTownHall https://t.co/pBYkuynfBN"
1120516370289111043,2019-04-23 02:34:55,I believe the House should initiate impeachment proceedings against the President of the United States. There is no political inconvenience exception to the United States Constitution. I explained my position tonight. #WarrenTownHall https://t.co/2XRbH7pj17
1120504658357829632,2019-04-23 01:48:23,"Here’s the deal: Girls dream big, fight hard, and win. #WarrenTownHall https://t.co/srg8oRPxbw"
1120503153894539264,2019-04-23 01:42:24,We’re not going to win this by name-calling or talking about Donald Trump. The way we’re going to do this is by talking about our vision and how it affects families across the country. Our economy and our democracy are at stake. #WarrenTownHall https://t.co/9oscxCypVe
1120501765735108608,2019-04-23 01:36:53,"When I first ran for office, I was told that people weren't ready to elect a woman. But I organized, built a grassroots movement, and fought for working people. And I won. That's how I'm going to be the first woman elected President of the United States. #WarrenTownHall https://t.co/mBm1OpTbmV"
1120500074038091778,2019-04-23 01:30:10,The student loan debt burden is crushing millions of families and acting as an anchor on our economy. That’s just wrong. My new plan would end this crisis and clean up the mess it’s caused. https://t.co/pjQIaA89jz
1120498568622739459,2019-04-23 01:24:11,"If we put a 2% tax on the wealthiest families in the country, we can provide universal Pre-K, universal free college, knock back student loan debt for 95% of Americans—and still have a trillion dollars leftover. #WarrenTownHall https://t.co/1MMM1eOghf"
1120496834223513601,2019-04-23 01:17:17,"I actually read the whole Mueller report. It’s clear Donald Trump obstructed an investigation into an attack on America and into his own behavior. Presidents are not above the law, and Congress has a constitutional duty to start impeachment proceedings. #WarrenTownHall https://t.co/UqAQQz0Ue1"
1120495552532291589,2019-04-23 01:12:12,There is no political inconvenience exception to the United States Constitution. #WarrenTownHall https://t.co/eblFRnsNrd
1120492326722387969,2019-04-23 00:59:23,"The only way we can make big, structural change is if we all work together. Chip in whatever you can and join our fight. Every donation makes a difference. https://t.co/P1dqRjOtgC"
1120492034060685312,2019-04-23 00:58:13,"I’m making a promise. On my first day as President, I will sign a moratorium on new fossil fuel drilling offshore and on public lands. Read more about my new public lands plan here: https://t.co/BBaeObPJVf #WarrenTownHall"
1120489347785154561,2019-04-23 00:47:32,Here’s what I learned when I first ran for Senate in 2012. People care more about their families than name calling. I know because I grew up in a family that was paycheck-to-paycheck. #WarrenTownHall
1120488877318463488,2019-04-23 00:45:40,"I want every little girl to know that she can run for office. So when I meet girls on the campaign trail, I say, “My name is Elizabeth. And I’m running for president because that’s what girls do.” And we pinky swear. #WarrenTownHall https://t.co/5gXUo5bP7n"
1120488449021304834,2019-04-23 00:43:58,"Every year that goes by, our Medicare system is a little further out of whack. Why? Because Washington keeps working for the rich and the powerful. Well I’m willing to take on that fight. We need to protect and expand Medicare. #WarrenTownHall"
1120488180690628608,2019-04-23 00:42:54,"It’s true: I was a registered Republican. Then I started doing research on why families were getting crushed. All the money was on one side, and all the hurting was on the other. I realized that all of the Republicans stood with the rich and powerful. #WarrenTownHall"
1120487265069948929,2019-04-23 00:39:16,"Our criminal justice system has a problem with race right at the heart of it, and we need to call it out for what it is. No one is safer in a world where we have a broken criminal justice system. #WarrenTownHall https://t.co/SOWhs8ktRi"
1120486890900267009,2019-04-23 00:37:47,"I took an oath to uphold our Constitution &amp; everyone else in Congress did too. If other members think we can ignore a president's repeated efforts to obstruct an investigation, then they should have to take that vote—and live with it for the rest of their lives. #WarrenTownHall"
1120485892097966081,2019-04-23 00:33:48,"If any other human being in this country did what was described in the Mueller report, they’d be in jail. This isn’t about politics—this is about principle for me. We need to protect our democracy for generations to come. #WarrenTownHall"
1120485510189867008,2019-04-23 00:32:17,"I stayed up late into the night reading the Mueller report. The facts are clear: A hostile foreign government attacked our 2016 election to help Donald Trump—and Donald Trump welcomed that help. Once elected, he obstructed the investigation into that attack. #WarrenTownHall"
1120484963068063745,2019-04-23 00:30:07,"Right now in this country, Black Americans are far more likely to be arrested for marijuana use than white Americans. That’s not right. We need to legalize marijuana—and I have a bipartisan bill would end the federal ban on marijuana. #WarrenTownHall"
1120484639922110464,2019-04-23 00:28:50,"Giant tech companies have too much power. My plan to #BreakUpBigTech prevents corporations like Amazon from knocking out the rest of the competition. You can be an umpire, or you can be a player—but you can’t be both. #WarrenTownHall https://t.co/73y1002QVv"
1120484150627250176,2019-04-23 00:26:53,"When I first ran for Senate, people told me that Massachusetts wasn’t ready for a woman Senator. I proved them wrong. So now when I meet girls on the campaign trail, I say, “My name is Elizabeth. And I’m running for president because that’s what girls do.” And we pinky swear."
1120483212978020354,2019-04-23 00:23:10,"Our criminal justice system has a problem with race right at the heart of it, and we need to call it out for what it is. We need to get rid of for-profit, private prisons—and when people leave prison, their right to vote needs to be reinstated. #WarrenTownHall"
1120481556106240000,2019-04-23 00:16:35,"Student loan debt is crushing families and holding back our economy. So today, I proposed something truly transformational: Universal free public college and the cancellation of debt for more than 95% of Americans with student loan debt. #WarrenTownHall https://t.co/JRWOoJlGze"
1120481228266848256,2019-04-23 00:15:17,"You have to pay something back so that everyone gets a chance. If we put a 2% tax on the wealthiest families in the country, we can have universal Pre-K, universal free college, knock back student loan debt for 95% of Americans—and still have a trillion dollars leftover."
1120479340133801987,2019-04-23 00:07:46,"Student loan debt is crushing students. My new proposal is about opportunity for everyone. Let’s cancel student loan debt for about 95% of Americans, make college universally available, and invest more in Pell Grants and HBCUs. And we’ll pay for it with my #UltraMillionaireTax."
1120468390680977408,2019-04-22 23:24:16,Woo-hoo! It was great seeing so many people fired up for our @CNN town hall tonight. Let’s do this. https://t.co/n87jqESS7H
1120459576380411906,2019-04-22 22:49:14,"You bet it does. For years, garbage for-profit institutions have defrauded unsuspecting students, especially veterans, single moms, and students of color. Enough. Time to turn off the spigot of taxpayer money. https://t.co/Xu6tPLlZrC"
1120456931997560832,2019-04-22 22:38:44,We need to level the playing field and create opportunity for all of our students—not just a select few. https://t.co/qpfFNH4CWD
1120454866936258560,2019-04-22 22:30:31,"Thanks, Jason! https://t.co/T9qyBdVTd3"
1120453111146057728,2019-04-22 22:23:33,"RT @luckytran: ""I’m calling for something truly transformational — the cancellation of up to $50,000 in student loan debt for 42 million Am…"
1120448629691617281,2019-04-22 22:05:44,"Your support means so much. Thank you, Ady. https://t.co/PSkSBEuqxA"
1120444391414534144,2019-04-22 21:48:54,"Tonight, our grassroots movement will have a chance to talk more about our new plans for student debt and universal free public college. Grab a friend to watch and let’s do this together. #WarrenTownHall https://t.co/od3c0QbBvS"
1120427810160615428,2019-04-22 20:43:01,"This morning on CNN, I talked to @mj_lee about my new plan to level the playing field for families and students getting crushed by student loan debt. This will be transformational for our country. https://t.co/qsGirqkX5y"
1120407412664668161,2019-04-22 19:21:57,"America’s public lands are some of our greatest treasures. On #EarthDay and every day, I’m making a promise: On day one of a Warren admin, I'll sign a moratorium on new fossil fuel drilling leases offshore and on public lands. More about my plan here: https://t.co/Pev5IXyliF https://t.co/dlSHBNE9hK"
1120397751756513281,2019-04-22 18:43:34,LGBTQ+ Americans have a right to live free from fear and discrimination—and that includes in the workplace. https://t.co/6t12FB4kFU
1120381703007109121,2019-04-22 17:39:48,"Big, structural change never quits! https://t.co/u8YFoprN4S"
1120368590073532418,2019-04-22 16:47:41,"Higher education opened a million doors for me—but today, it’s almost impossible for young people to find that kind of opportunity. My new idea for cancellation of student loan debt and universal free public college would change that. https://t.co/hCuPRaSwrd"
1120364207680172032,2019-04-22 16:30:17,"See you tonight, @SaintAnselm! https://t.co/Y10LfKPXYc"
1120360748889387008,2019-04-22 16:16:32,"Exactly, Italo! I’m grateful for your support. https://t.co/kZFmCUlT8b"
1120355697840074753,2019-04-22 15:56:28,"Thank you, Lorenza! Together, we’re fighting to level the playing field for students across the country. https://t.co/5JNobzGm7j"
1120349350880784384,2019-04-22 15:31:14,RT @rweingarten: .@ewarren is making public education and higher education a priority in her campaign. This proposal is as consequential as…
1120346383326773249,2019-04-22 15:19:27,My new plan is a chance to talk about what’s broken and how we fix it. It’s how we can give our students a fighting chance at the American dream again. https://t.co/W97FRuvY2j
1120334604244799489,2019-04-22 14:32:39,"This law is wrong—plain and simple. We need a constitutional amendment that protects every American citizen's right to vote and get that vote counted. Thank you, @JeanneShaheen for leading the fight. https://t.co/My1srb1DrY"
1120321864604237824,2019-04-22 13:42:01,"I’m calling for universal free college and the cancellation of student loan debt for more than 95% of Americans. This is the kind of big, structural change we need to make sure our kids have opportunity in this country. https://t.co/KERw3APDMo"
1120311725268590592,2019-04-22 13:01:44,"Finally, my plan will ban for-profit colleges from receiving any federal dollars. Time to cut off taxpayer money to schools that suck down billions while burying lower-income students, servicemembers, and students of color in mountains of debt."
1120311724081590272,2019-04-22 13:01:44,We'll knock down artificial barriers to enrollment by prohibiting public colleges from considering citizenship status or criminal history in admissions decisions.
1120311722705920001,2019-04-22 13:01:43,"Next, my plan will dedicate $100 billion in new funding to help students cover non-tuition expenses at public colleges—a barrier that disproportionately affects lower-income students and students of color—to make zero debt at graduation a reality for everyone."
1120311720139022337,2019-04-22 13:01:43,"First, my plan will provide at least $50B—and potentially far more—to HBCUs and Minority-Serving Institutions. It’ll also make additional funding available to states that demonstrate serious improvement in enrollment/graduation rates for lower-income students &amp; students of color."
1120311717387472897,2019-04-22 13:01:42,"Free tuition at public institutions isn’t enough. We must also make our higher education system better serve lower-income families and communities of color, and ensure everyone can graduate with zero debt. https://t.co/IG9J5CiNb7"
1120304107653357569,2019-04-22 12:31:28,"That’s why I’m proposing a historic new federal investment in public higher education that will eliminate the cost of tuition and fees at every public two-year and four-year college in America, plus an additional $100 billion investment in Pell Grants. https://t.co/IG9J5CiNb7"
1120304105753387009,2019-04-22 12:31:27,"I was able to get a quality, public education for just $50 a semester. That kind of opportunity is virtually impossible to find today. As states have invested less in community colleges and public four-year colleges, schools have raised tuition and fees to make up the gap."
1120296821300060160,2019-04-22 12:02:30,Student loan debt is crushing millions of families. That’s why I’m calling for something truly transformational: Universal free college and the cancellation of debt for more than 95% of Americans with student loan debt. Read all about it here: https://t.co/IG9J5CiNb7
1120141583091941376,2019-04-22 01:45:39,"When workers fight, workers win. I’m glad to see that @StopandShop workers are returning to work with an agreement for higher wages and continued health and pension benefits. #UnionStrong
https://t.co/0EITKXyMGd"
1120084965381890059,2019-04-21 22:00:40,"Why do I love #GameOfThrones? It’s the women (duh!). Looking forward to tonight’s episode. In the meantime, you can read my review of the season premiere here. https://t.co/9AkRWW6kjn"
1120040660780879872,2019-04-21 19:04:37,These hate crimes were meant to strike fear in the hearts of African Americans. I'm glad our country is coming together to rebuild the churches that were hatefully burned down. Every house of worship should be a haven for people to worship without fear. https://t.co/DgQcnMBiib
1120001938576367617,2019-04-21 16:30:45,"I grew up in the McFarlin Methodist church in Oklahoma. Today, I’m remembering some of the lessons I learned in Sunday School: By doing good, we can live a righteous life. Happy Easter Sunday! https://t.co/poGl9qeDXu"
1119973288741097472,2019-04-21 14:36:54,I'm heartsick for the victims of today’s terrorist attacks in Sri Lanka. Hundreds have been killed and wounded. To slaughter worshippers at church during Easter service is an act of great evil. My thoughts and my prayers are with the victims and their loved ones.
1119792142577274880,2019-04-21 02:37:06,"Last night on @maddow, I made it clear: We can’t ignore a president’s repeated efforts to obstruct an investigation into his own disloyal behavior. The House should initiate impeachment proceedings against the President of the United States. https://t.co/QHxYmYUtxM"
1119774279942443008,2019-04-21 01:26:07,What a guy. https://t.co/1mon0BijiN
1119763265582784512,2019-04-21 00:42:21,"Thank you for having me, Weare. https://t.co/qiZ6ViS8Uq"
1119760631115198464,2019-04-21 00:31:53,RT @ABCWorldNews: “DERAIL OR OBSTRUCT”: Democratic presidential candidate Senator Elizabeth Warren urged lawmakers to open impeachment proc…
1119723084959887360,2019-04-20 22:02:41,"Today, I got asked a really important question in New Hampshire. This is a matter of principle, and here is why I’m in this fight all the way. https://t.co/KHAziXjRD0"
1119639531379150850,2019-04-20 16:30:40,"I was out in Utah talking about environmental issues &amp; on the plane back, the Mueller report came out—so I started reading, &amp; read late into the night. The report hands this now to Congress &amp; the fundamental question for us is: ""Is there going to be some accountability here?"" https://t.co/3Wk7ZFC8I0"
1119611907542069248,2019-04-20 14:40:54,LIVE: Yesterday I called on the House to begin impeachment proceedings. This is a matter of principle for me. https://t.co/X91tKMcn51
1119465069971156992,2019-04-20 04:57:25,"I read the Mueller report.  When I got to the end, I realized this is a point of principle. Because it matters not just for this president, but for all future presidents. No one is above the law. https://t.co/RdAHQYoH0V"
1119331296470237185,2019-04-19 20:05:51,The severity of this misconduct demands that elected officials in both parties set aside political considerations and do their constitutional duty. That means the House should initiate impeachment proceedings against the President of the United States.
