id,created_at,text
189018515406192640,2012-04-08 15:55:00,"b'My experience with Mike Wallace -- integrity, charm, character. A great one goes home.'"
188641102880968704,2012-04-07 14:55:18,"b'This Easter, we are thankful for our brave men and women in uniform who are serving our country & are away from their families.'"
188383665854758912,2012-04-06 21:52:20,b'Hope everyone has a great Easter weekend. It\xe2\x80\x99s been a busy few months \xe2\x80\x93 looking forward to some family time \nhttp://t.co/gYvvNn6Z'
188353910396829696,2012-04-06 19:54:06,b'Ann joins me in wishing everyone sitting down for a Passover Seder a joyous time with family and friends.'
188295415903432707,2012-04-06 16:01:40,"b'Praying for a quick recovery for Bella. Ann and I are keeping Rick, Karen and the entire Santorum family in our thoughts.'"
188253841475633152,2012-04-06 13:16:28,"b""This is a weak jobs report that shows the employment market remains stagnant. Americans are paying a high price for @BarackObama's policies."""
187540074890661889,2012-04-04 14:00:12,b'.@BarackObama\xe2\x80\x99s mudslinging can\xe2\x80\x99t cover up his failed energy policies. America deserves solutions http://t.co/zSb5vmrC'
187363511960207360,2012-04-04 02:18:36,b'Thank you WI! Tonight we\xe2\x80\x99ve taken another big step toward making @BarackObama a one-term president http://t.co/Y5MxCsdw'
187349451067756545,2012-04-04 01:22:44,b'Big thanks to everyone in MD and DC \xe2\x80\x93 what a way to start the night. Excited for WI results to start coming in.'
186520707335860225,2012-04-01 18:29:36,b'America today has the highest business tax in the world and now @BarackObama wants a new global business tax. #ObamaLogic'
186502913772879872,2012-04-01 17:18:54,b'Great to hear Rep. Sensenbrenner cast his absentee ballot for me in WI. I appreciate his support.'
186449419057635328,2012-04-01 13:46:20,b'.@SenRonJohnson experience as a successful manufacturer & job creator brought him to Washington in 2011 \xe2\x80\x93 proud to have his support.'
185724886566715392,2012-03-30 13:47:18,b'Getting ready for WI speech. @BarackObama says he\xe2\x80\x99s 4th best president of all time. How do you rank him? #ObamaLegacy'
185718847435845633,2012-03-30 13:23:18,"b'With @RepPaulRyan\xe2\x80\x99s support, I have every confidence that we can begin the hard work of setting our country on a better course.'"
185493490241769472,2012-03-29 22:27:49,b'There is no greater honor than earning President George H.W. Bush\xe2\x80\x99s endorsement. I am grateful for all he and Barbara have done.'
185357084265680896,2012-03-29 13:25:47,b'.@BarackObama named himself one of the 4 best presidents in history. He sure is the best president at piling on debt http://t.co/S29azx4I'
185185663342219266,2012-03-29 02:04:37,b'Ann joins me in thanking @MarcoRubio for the confidence he is placing in my leadership and for the great honor he has done me today.'
185004349594939392,2012-03-28 14:04:08,"b'In his dealings with the Kremlin, @BarackObama has once again demonstrated breathtaking weakness http://t.co/prCkSbQA'"
184827640333606912,2012-03-28 02:21:58,b'Always fun seeing @JayLeno - thanks for a great interview. Tune in tonight to see it http://t.co/iM4phTqw'
184315695977349120,2012-03-26 16:27:40,b'Fill in the blank. @BarackObama: I\xe2\x80\x99ll have more flexibility to _______ after the election. #ObamaFlexibility'
183752625731280896,2012-03-25 03:10:14,b'Congratulations to Rick Santorum in LA. I look forward to the contests to come and to defeating @BarackObama in November.'
183708988095991808,2012-03-25 00:16:50,b'Ann and I send our thoughts and prayers to Vice President Cheney for a fast and full recovery.'
183249992792805376,2012-03-23 17:52:57,b'Both Obamacare AND the #hhsmandate have to go. I stand with those who are rallying to support religious liberty.'
183231643186757632,2012-03-23 16:40:02,b'Almost baseball season - enter for the chance to join me and @TRomney at a game in Boston on Patriots\xe2\x80\x99 Day http://t.co/qNah6yGH'
183170683587674113,2012-03-23 12:37:48,b'Today is the second anniversary of Obamacare. I will repeal it if I am president http://t.co/TK7zAnEj'
182836434393235456,2012-03-22 14:29:37,"b'As Gov. of MA, I cut taxes, balanced the budget, wiped out a $3B deficit &amp; left behind a $2B rainy day fund http://t.co/dhM7MLnd'"
182486179663446017,2012-03-21 15:17:50,"b'March 21st is turning into a pretty big day. Anniversary, @tromney\xe2\x80\x99s birthday, and now an endorsement from @JebBush.'"
182463828091617281,2012-03-21 13:49:01,"b'Happy 43rd anniversary to my sweetheart and better half, Ann http://t.co/e9cSyiEg'"
182283748975452160,2012-03-21 01:53:27,"b""Thank you, IL! We've taken one more step toward restoring the promise of America, and tomorrow we wake up &amp; start again."""
181791582347988994,2012-03-19 17:17:45,b'Sign my petition telling @BarackObama to replace the Gas Hike Trio with leaders who support affordable energy http://t.co/X9Y1FvFe'
181728388719972353,2012-03-19 13:06:38,b'.@BarackObama should fire his gas hike trio. We need policies to get us energy at prices we can afford http://t.co/lKI7OzcP'
181536537639526400,2012-03-19 00:24:18,"b'Ann and I are deeply grateful to @LuisFortuno51, his wife, &amp; the people of Puerto Rico for their support &amp; help in winning today\xe2\x80\x99s primary'"
181173095506251777,2012-03-18 00:20:06,"b""America didn't have trillion dollar deficits until @BarackObama. Since he took office, we've seen 4. http://t.co/oHsnY9Ek #ObamaIsntWorking"""
181129390158135296,2012-03-17 21:26:26,b'Ann &amp; I thank the voters who took part in today\xe2\x80\x99s caucuses in Missouri. I am proud &amp; honored to have earned the support received today.'
180780798780260353,2012-03-16 22:21:15,b'#FF Romney Team @DGJackson @EricFehrn @AndreaMSaul @GGitcho @ZacMoffatt @LanheeChen @RyanGOP @TeamRomney #Mitt2012'
180766760616734720,2012-03-16 21:25:28,"b""Missouri voters have a chance to take a step toward changing the direction of our country. I'm asking for your support http://t.co/TD11bFRL"""
180290243692474369,2012-03-15 13:51:58,"b""I'll be bringing one supporter out to CA to grab a bite with me at my favorite burger place \xe2\x80\x93 enter here http://t.co/uzlnx3ae"""
179749488599117824,2012-03-14 02:03:12,b'Will be a late night waiting for results from American Samoa and HI but a big THANK YOU to everyone who voted in MS and AL. #Mitt2012'
179617325924892673,2012-03-13 17:18:02,b'These are the conversations that matter the most. Great to have a few one-on-one discussions in St. Louis http://t.co/M00kUbkk'
179230112426893314,2012-03-12 15:39:23,"b'Great event in Mobile, AL this morning with @FoxOutdoors. Thanks to everyone who braved the rain to be there http://t.co/Sj3XG9wh'"
178911852372295680,2012-03-11 18:34:44,"b'Pleased to have the support of Jeff Foxworthy, @foxoutdoors,\xc2\xa0a true southern gentleman and avid outdoorsman. #Mitt2012'"
178655766088122368,2012-03-11 01:37:08,b'The results from today\xe2\x80\x99s caucuses in the island territories are in. We received 25 of 27 delegates. Thank you for your support!'
178230960003878913,2012-03-09 21:29:06,b'Spending a lot of time on the road means you have to carry good music \xe2\x80\x93 here are some of my favorites http://t.co/q06QyGTk'
178207727129079808,2012-03-09 19:56:47,b'I am thrilled to get the support of Alabama\xe2\x80\x99s lead singer Randy Owen. Great music and great endorsement ahead of the AL primary!'
178153280722042881,2012-03-09 16:20:26,"b'Obama movie producer should talk to the millions of unemployed, our grandchildren who will pay for his big-govt. programs, & our veterans.'"
177235372248530944,2012-03-07 03:33:00,"b'Tonight, we celebrate because of you \xe2\x80\x93 the voters, volunteers & supporters who have made all of this possible. Thank you.'"
177152467690201088,2012-03-06 22:03:34,b'Hope is not a foreign policy. My full address to AIPAC this morning http://t.co/B5hiWH1w\n#Mitt2012.'
177085543904055297,2012-03-06 17:37:38,b'It\xe2\x80\x99s Super Tuesday. Ann and I are voting in MA this afternoon. Click here if you need to find your polling place http://t.co/S9U7jxwX'
176824610053038082,2012-03-06 00:20:46,b'.@BarackObama again playing the politics of class warfare while proposing large tax increases. I will cut tax rates for all Americans.'
176355150049460225,2012-03-04 17:15:18,b'.@TomCoburn joins the Daily Oklahoman in endorsing my conservative message http://t.co/yea2522v #Mitt2012'
176324331880714240,2012-03-04 15:12:51,b'Thank you @EricCantor for joining the team and helping get our message out prior to Virginia\xe2\x80\x99s primary! #Mitt2012'
176129094403104768,2012-03-04 02:17:03,"b'I\xe2\x80\x99m heartened to have won the Washington caucuses, and I thank the voters for their support today. #Mitt2012'"
176069863536738305,2012-03-03 22:21:41,"b""My wife Ann is my best friend and the rock of our family. I'm very lucky to have her by my side through this process http://t.co/EH3BUIzH"""
175725666413723648,2012-03-02 23:33:58,b'My heart goes out to the tornado victims. Please give what you can to the @RedCross http://t.co/LL0Dqsup'
175239328140759042,2012-03-01 15:21:26,"b'Ann and I are deeply saddened by the passing of @AndrewBreitbart: brilliant entrepreneur, fearless conservative, loving husband and father.'"
174974802640113665,2012-02-29 21:50:18,b'Why did Democrats in MI vote for @RickSantorum? Because they want 4 more years of @BarackObama http://t.co/OXPmGNpH'
174876289537294336,2012-02-29 15:18:51,"b""After last night's victories, the Obama attack machine is gearing up for Ohio. We need you to help fight back http://t.co/uBtXSeoF"""
174696524423495680,2012-02-29 03:24:31,b'I take great pride in my Michigan roots and am humbled to have received so much support here these past few weeks. On to the March contests.'
174688193327796224,2012-02-29 02:51:25,b'Thank you AZ! Overwhelmed by all the support. We\xe2\x80\x99re watching closely as votes continue to be counted in Michigan. #Mitt2012'
174527031143436288,2012-02-28 16:11:01,"b"".@RickSantorum knows he's losing GOP vote so he's inviting Democrats to vote in the MI Primary. Fight back http://t.co/XPOW5FCu #pathetic"""
174235352033267712,2012-02-27 20:51:59,b'Special musical guest tonight at the rally in Royal Oak http://t.co/3SkPlxDV. Come if you can - will be great http://t.co/lSxdRvlp'
173813979351744513,2012-02-26 16:57:36,b'What a week already - Daytona 500 today and an endorsement from @GovBrewer. Looking forward to the AZ & MI primaries on Tuesday.'
173740343517392897,2012-02-26 12:05:00,b'Tune in to @FoxNewsSunday this morning \xe2\x80\x93 I\xe2\x80\x99ll be sitting down with Chris Wallace #Mitt2012'
173135285994004480,2012-02-24 20:00:43,b'RT @RobPortman In Columbus celebrating the opening of the new @MittRomney headquarters in Ohio. http://t.co/MWYN3FBA #TCOT #OHTCOT'
173116770088005632,2012-02-24 18:47:09,b'My plans will strengthen America & strengthen Michigan. Let\xe2\x80\x99s restore America\xe2\x80\x99s promise & create an age of prosperity http://t.co/bcimS0go'
172706017229029377,2012-02-23 15:34:57,b'We must make the tax code simpler and fairer. Read my @WSJ op-ed on reducing tax rates to promote economic growth http://t.co/QslhQaCQ'
172483293797814272,2012-02-23 00:49:56,b'For updates during the #CNNDebate follow @EricFehrn @AndreaMSaul @GGitcho @ZacMoffatt @LanheeChen @RyanGOP @TeamRomney #Mitt2012'
172470375538638849,2012-02-22 23:58:36,b'Tune in at 8:00 PM EST for the #CNNDebate  (@ GOP-CNN Debate) http://t.co/K3or3pIh'
172400505014861825,2012-02-22 19:20:58,"b'My bold, pro-growth tax plan will restore America\xe2\x80\x99s promise with more jobs, less debt, and smaller government \nhttp://t.co/i6YGSWeX'"
172008971513774081,2012-02-21 17:25:09,b'Ann\xe2\x80\x99s way ahead of me on this one \xe2\x80\x93 check out her Pinterest page here http://t.co/p9tUtTTF'
170615240818556928,2012-02-17 21:06:57,b'Another strong conservative voice for Team Michigan \xe2\x80\x93 excited to have Lt. Gov. @BrianCalley on board.'
170503207167066112,2012-02-17 13:41:47,"b'After 3 years, the only thing @BarackObama\xe2\x80\x99s stimulus has produced is a series of broken promises http://t.co/sMJJ2Q3Q'"
170215805563318272,2012-02-16 18:39:45,"b'Should the 21st century be an American century? To answer, it is only necessary to contemplate the alternatives http://t.co/HuJf6k4D'"
170173869536194560,2012-02-16 15:53:06,b'Gov. Snyder is another conservative businessman committed to getting Michigan & this country back on track. Proud to have his endorsement.'
169519957980352512,2012-02-14 20:34:42,b'I want to make Michigan stronger and better. Michigan has been my home and this is personal http://t.co/vhNIBOhS'
169448890645483520,2012-02-14 15:52:18,b'Happy Centennial Arizona! Great event yesterday in Mesa and look forward to being back for more campaigning & the CNN debate.'
169425778910568448,2012-02-14 14:20:28,b'The President tells us that without his intervention things in Detroit would be worse. I believe he\xe2\x80\x99s wrong http://t.co/A6AA2QPC'
168487973212528641,2012-02-12 00:13:57,"b'Tonight, I thank the voters of Maine. I\xe2\x80\x99m committed to turning around America & am heartened to have the support of so many.'"
168454539740053505,2012-02-11 22:01:06,b'Honored to have won the CPAC straw poll. I\xe2\x80\x99m heartened that so many friends here agree with me about the need for conservative change.'
168051256810672128,2012-02-10 19:18:36,b'This election is not just about getting more votes. Defeating @BarackObama is only one step toward our greater goal of saving America. #CPAC'
167764850838216705,2012-02-10 00:20:32,"b'If you agree it\xe2\x80\x99s time to stop the spending and pass a permanent ban on earmarks, stand with me & sign the petition http://t.co/s8pdGe5J'"
167665976031195138,2012-02-09 17:47:38,b'Thank you Amb. Glendon for standing with me as we fight President Obama\xe2\x80\x99s attacks on religion http://t.co/sviRdOWI'
167363215410479104,2012-02-08 21:44:34,b'I was honored to have been asked to lead the Olympics 10 years ago & am delighted that UT is thinking about bidding for the 2022 games.'
167290227872894977,2012-02-08 16:54:33,"b'The campaign trail is always full of surprises, and I\xe2\x80\x99m inviting one supporter to join me for a day on the road http://t.co/omeaBtKV'"
167249732291399681,2012-02-08 14:13:38,"b'.@BarackObama wants to raise taxes & grow government. I\xe2\x80\x99ll cut taxes and make government smaller, simpler, & smarter http://t.co/u5ybzn8M'"
167108677105487872,2012-02-08 04:53:08,"b""Congratulations to my fellow Republicans tonight. We'll continue to take our message of liberty & prosperity to every corner of the country."""
167009688834154496,2012-02-07 22:19:47,b'Roberta McCain is 100 years young today. Ann and I wish her a Happy Birthday and send our best wishes to the whole McCain family.'
166625336082186240,2012-02-06 20:52:30,"b'Only in @BarackObama\'s world is it an ""economic positive"" that Americans are giving up hope and leaving the workforce #clueless'"
166611106029252608,2012-02-06 19:55:57,"b'Ronald Reagan would have been 101 today. As we celebrate his legacy, we remember the hope and optimism he had for America.'"
166556946562953217,2012-02-06 16:20:45,b'Thanks for your help in the NV victory MT @RealDonaldTrump Let\xe2\x80\x99s make @BarackObama a one term president http://t.co/S29azx4I #OneTermFund'
166548687055630336,2012-02-06 15:47:55,"b'If you\xe2\x80\x99ve had enough of the Obama Administration\xe2\x80\x99s attacks on religious liberty, stand with me & sign the petition http://t.co/qJfy8lDH'"
166265570600296448,2012-02-05 21:02:55,b'Sign up to be a Romney Representative  at your CO Caucus on Tuesday by clicking here http://t.co/44iR3ZkM'
166218143981772800,2012-02-05 17:54:28,b'Go Pats! Happy Super Bowl Sunday everyone.'
165994713806155776,2012-02-05 03:06:38,b'Thank you NV! Our message of restoring America\xe2\x80\x99s greatness continues to resonate through the west & across the country #NVCaucus #Mitt2012'
165559821368688641,2012-02-03 22:18:32,b'Thanks to all who donated so far. #OneTermFund has reached over $1.25M. Help make the one-term proposition a reality http://t.co/S29azx4I'
165454326456791040,2012-02-03 15:19:20,"b'While we welcome a decline in unemployment, these numbers can\xe2\x80\x99t hide the fact that the President\xe2\x80\x99s policies have prevented a true recovery.'"
165440959067336704,2012-02-03 14:26:13,b'I will not hesitate to use the powers of the presidency to protect religious liberty http://t.co/6sdtEjts #Mitt2012'
165187068107042816,2012-02-02 21:37:20,b'3 years to the day since @BarackObama\xe2\x80\x99s one-term proposition. Today he\xe2\x80\x99s focused on saving HIS job http://t.co/S29azx4I #OneTermFund'
165145843891052544,2012-02-02 18:53:32,"b'18 hours ago, @BarackObama launched a 2-Term Fund. His priority should be worrying about your job, not saving his own http://t.co/S29azx4I'"
164903358698749952,2012-02-02 02:49:59,"b""He's right. http://t.co/S29azx4I #OneTermFund RT @BarackObama: One-term president? It's up to you."""
164892256753565697,2012-02-02 02:05:52,b'How many excuses can @BarackObama buy with $2M? We need a President who is accountable http://t.co/S29azx4I #OneTermFund'
164873464019296256,2012-02-02 00:51:11,b'Thanks everyone for helping the #OneTermFund raise over 600k so far. Continue to hold the President accountable http://t.co/S29azx4I'
164525346429992960,2012-02-01 01:47:53,b'One term. One message. We\xe2\x80\x99re holding @BarackObama accountable: http://t.co/S29azx4I #OneTermFund'
164514468989112322,2012-02-01 01:04:40,"b'Thank you FL! While we celebrate this victory, we must not forget what this election is really about: defeating Barack Obama. #Mitt2012'"
164348830622564353,2012-01-31 14:06:29,"b'Today is the FL Primary. As we\xe2\x80\x99ve seen so far, every single vote counts. Take action & get out the vote: http://t.co/LEC0jls5'"
164086592884064256,2012-01-30 20:44:26,b'The FL Primary is tomorrow. Help us get the job done. Sign up to help get out the vote: http://t.co/zt17ERLb #Sayfie'
164041659900887041,2012-01-30 17:45:54,b'We\xe2\x80\x99re going to take back the White House. We\xe2\x80\x99re going to take back our country. Stand with me http://t.co/Em51pUNE #Mitt2012 #Sayfie'
163995700596711426,2012-01-30 14:43:16,b'FL Voters: Make sure your vote is counted and return your absentee ballot by 7:00 p.m. tomorrow night #Sayfie #Mitt2012'
163633703698960384,2012-01-29 14:44:49,"b""Ann and I send prayers and best wishes for Bella's good health to Rick and Karen Santorum and their entire family."""
163345344569147392,2012-01-28 19:38:59,b'Today is the last day to vote early and avoid long lines. Click here to find out where: http://t.co/oI1HxqAS #Sayfie #Mitt2012'
163274721742430209,2012-01-28 14:58:21,"b'History Lesson: In 1997, Democrats and Republicans overwhelmingly found Newt Gingrich guilty of ethics violations http://t.co/tmToityA'"
162907666925096960,2012-01-27 14:39:49,"b'Make sure your vote is counted and return your absentee ballot by 7:00 p.m. on Tuesday, January 31st #Sayfie #Mitt2012'"
162700296269729792,2012-01-27 00:55:48,b'For updates during the #CNNDebate follow @EricFehrn @AndreaMSaul @GGitcho @ZacMoffatt @LanheeChen @RyanGOP @TeamRomney #Mitt2012'
162690152165154816,2012-01-27 00:15:29,b'Tune in at 8:00 P.M. tonight for the #CNNDebate  (@ CNN Presidential Debate w/ 8 others) http://t.co/SFOv1CrW'
162196912261435392,2012-01-25 15:35:32,b'Today is the last day to request an absentee ballot in FL. Click here for more info: http://t.co/oI1HxqAS #Sayfie #Mitt2012'
161968847631552512,2012-01-25 00:29:17,b'What is critical is that we make today Barack Obama\xe2\x80\x99s last State of the Union http://t.co/dSWCiXBp #1000Days'
161914622931251200,2012-01-24 20:53:48,b'This President\xe2\x80\x99s agenda made these troubled times last longer. He made it harder for the economy to recover http://t.co/WUuhjdPu'
161658196300271616,2012-01-24 03:54:52,b'Newt Gingrich has a long record as a Washington insider & is the only Speaker to be reprimanded for ethics violations http://t.co/AHqSOBtc'
161627043300261889,2012-01-24 01:51:04,b'For updates during the #FLDebate follow @EricFehrn @GGitcho @ZacMoffatt @LanheeChen @RyanGOP @TeamRomney #Mitt2012'
161613515562549249,2012-01-24 00:57:19,b'Tune in at 9:00 P.M. for the #FLDebate  (@ NBC News Republican Candidates Debate w/ 3 others) http://t.co/0FyvuCgL'
161516889229623297,2012-01-23 18:33:21,"b'I wish Sen. Kirk a speedy recovery & swift return to the Senate, so he can continue his important work for the people of Illinois.'"
161487278592626688,2012-01-23 16:35:42,"b'While Florida families lost everything in the housing crisis, Newt Gingrich cashed in: http://t.co/pCxdelMD'"
161132434254069760,2012-01-22 17:05:40,b'Don\xe2\x80\x99t wait until Jan 31st. Cast your vote early. Click here to find out where to cast your ballot http://t.co/zzP1q2aU #Sayfie #Mitt2012'
160894603694850048,2012-01-22 01:20:37,"b'Tonight, I congratulate Speaker Gingrich on a hard-fought campaign here in South Carolina.'"
160743520049692672,2012-01-21 15:20:16,b'Today is the South Carolina Primary. You can make the difference http://t.co/LEC0jls5 #Mitt2012 #SCGOP'
160499081490341889,2012-01-20 23:08:57,"b'Tomorrow, SC voters will have a chance to change the direction of our country, and I\xe2\x80\x99m asking for your vote http://t.co/HaBSnlf6'"
160449241574146048,2012-01-20 19:50:54,b'We\xe2\x80\x99re not done yet. Take action & sign up to Get-out-the-Vote in South Carolina: http://t.co/3QHH0fx3 #Mitt2012 #SCGOP'
160418289682628608,2012-01-20 17:47:55,b'The truth is @BarackObama has failed & his vision for America is wrong. This election is about reversing that failure http://t.co/wn5QEiNs'
160376891646296064,2012-01-20 15:03:25,"b""Welcome to the team @bobmcdonnell! If you're in SC, he'll be joining us on the trail today in Charleston http://t.co/NAHvvnAV"""
160210607264645120,2012-01-20 04:02:39,b'It\xe2\x80\x99s wrong for @BarackObama & his supporters to seek to divide America by waging class warfare. We\xe2\x80\x99re better than that http://t.co/g48VVLO0'
160162465194311682,2012-01-20 00:51:22,b'For updates during the #CNNDebate follow @EricFehrn @GGitcho @AndreaMSaul @ZacMoffatt @LanheeChen @RyanGOP @TeamRomney #Mitt2012'
160150782371573760,2012-01-20 00:04:56,b'Tune in at 8:00 P.M. EST for the #CNNDebate  (@ Southern Republican Leadership Conference-CNN Debate w/ 7 others) http://t.co/ie9CdJik'
160111558704377856,2012-01-19 21:29:04,b'.@BarackObama wants to fundamentally transform America. I stand ready to lead us down a different path http://t.co/O8J5aARU'
160039896210350081,2012-01-19 16:44:19,"b'We need solutions, not 4 more years of empty promises & Washington as usual. Welcome to Florida @BarackObama http://t.co/FgPxg41p'"
159758381555527680,2012-01-18 22:05:40,b'The new @BarackObama doctrine is that America must recognize its limits. That is the wrong course for our nation.'
159384531357548544,2012-01-17 21:20:08,b'Today @GovChristie proposed a 10% income tax cut.  The NJ comeback has begun.  #JerseyComeback'
159355392260964352,2012-01-17 19:24:20,b'The fiscal catastrophe in Europe warns of what lies ahead if @BarackObama gets 4 more years to move toward a European-style welfare state'
159127949411483650,2012-01-17 04:20:34,"b'The President has run out of ideas. Now, he\xe2\x80\x99s running out of excuses. And 2012 will be the year he runs out of time.'"
159091826685517824,2012-01-17 01:57:01,b'For updates during the #SCDebate follow @EricFehrn @GGitcho @AndreaMSaul @ZacMoffatt @LanheeChen @RyanGOP @TeamRomney #Mitt2012'
159086227100934145,2012-01-17 01:34:46,b'What do you want to see discussed during tonight\xe2\x80\x99s #SCDebate? #Mitt2012'
159072144834310144,2012-01-17 00:38:49,b'Tune in to @FoxNews at 9:00 p.m. EST for the #SCDebate  (@ FOX News - SC GOP - WSJ Debate w/ 2 others) http://t.co/c5PGpWMY'
158963529540571136,2012-01-16 17:27:13,b'More Americans have lost their jobs under @BarackObama than any president in modern history. http://t.co/CyCSpY9M'
158957484571230211,2012-01-16 17:03:12,"b'I salute Jon Huntsman & his wife Mary Kaye. He ran a campaign based on unity not division, & love of country.  I appreciate his support.'"
158910870964011008,2012-01-16 13:57:58,"b'On MLK Day, we remember an outstanding American who brought our country closer to its historic promise of liberty and justice for all.'"
157937444136812544,2012-01-13 21:29:55,b'.@BarackObama wants to put free enterprise on trial. We must offer an alternative vision. http://t.co/umiM3SoX #Mitt2012'
157844521810538496,2012-01-13 15:20:41,"b'As a conservative businessman, I look forward to bringing a record of job creation to the White House http://t.co/an3sqAkb'"
157115110681354242,2012-01-11 15:02:16,"b'Make no mistake, in this campaign, I will offer the American ideals of economic freedom a clear and unapologetic defense.'"
156917634317828097,2012-01-11 01:57:34,"b'This Granite State moment is one we will always remember. Tonight, we celebrate.  Tomorrow, we go back to work.'"
156838333698416640,2012-01-10 20:42:27,"b'Together, we can restore America\xe2\x80\x99s greatness. Stand with me: http://t.co/aWYVhEkx #Mitt2012 #FITN'"
156742697489678336,2012-01-10 14:22:25,b'Today is the New Hampshire Primary. Stand up and be counted. Help us earn the vote in New Hampshire: http://t.co/LEC0jls5 #FITN'
156456112344940544,2012-01-09 19:23:38,b'Every vote counts. Every call you make counts. Help us get out the vote in New Hampshire: http://t.co/UrChGxxy #Mitt2012 #FITN'
