id,created_at,text
1108479818000224256,2019-03-20 21:25:57,b'ISIS Caliphate two years ago in red vs. ISIS Caliphate TODAY. (Was even worse in November 2016 before I took office\xe2\x80\xa6 https://t.co/cBkbM9wvMS'
1108472769589633025,2019-03-20 20:57:57,b'Really beautiful to see! https://t.co/DKq2TIeiSs'
1108471193353375744,2019-03-20 20:51:41,"b'Great news from @Ford! They are investing nearly $1 BILLION in Flat Rock, Michigan for auto production on top of a\xe2\x80\xa6 https://t.co/gluXIFB7vv'"
1108463989649014784,2019-03-20 20:23:04,b'I am thrilled to be here in Ohio with the hardworking men and women of the Lima Army Tank Plant! We are here today\xe2\x80\xa6 https://t.co/UKQ0MgjnUJ'
1108335293671845888,2019-03-20 11:51:40,"b'George Conway, often referred to as Mr. Kellyanne Conway by those who know him, is VERY jealous of his wife\xe2\x80\x99s succe\xe2\x80\xa6 https://t.co/TgFSVYlwdh'"
1108217768187449344,2019-03-20 04:04:40,"b'The Democrats are getting very \xe2\x80\x9cstrange.\xe2\x80\x9d They now want to change the voting age to 16, abolish the Electoral Colle\xe2\x80\xa6 https://t.co/xGK4FgHNmq'"
1108214845294428161,2019-03-20 03:53:03,b'Not a good situation! https://t.co/uaMcSrX4yM'
1108190837257764864,2019-03-20 02:17:39,b'....just the large States - the Cities would end up running the Country. Smaller States &amp; the entire Midwest would\xe2\x80\xa6 https://t.co/N7cN3C4Sx6'
1108187855954870272,2019-03-20 02:05:48,b'Campaigning for the Popular Vote is much easier &amp; different than campaigning for the Electoral College. It\xe2\x80\x99s like t\xe2\x80\xa6 https://t.co/kHqpkDh6QB'
1108164711865028609,2019-03-20 00:33:50,"b""RT @DonaldJTrumpJr: My latest OP-Ed on Tech Censorship - check it out and RT. \n\nConservatives face a tough fight as Big Tech's censorship e\xe2\x80\xa6"""
1108147024485122053,2019-03-19 23:23:33,"b'Thank you @JesseBWatters, could not have said it any better myself! https://t.co/HirL10zwZl'"
1108118176754208771,2019-03-19 21:28:55,"b'Amazingly, CNN just released a poll at 71%, saying that the economy is in the best shape since 2001, 18 years! WOW,\xe2\x80\xa6 https://t.co/XzWmctKjJa'"
1108036445510516736,2019-03-19 16:04:09,b'https://t.co/95I4towyEP'
1108028566791471104,2019-03-19 15:32:51,b'I will be looking into this! #StopTheBias https://t.co/ZTWQolvmdM'
1108004465121075200,2019-03-19 13:57:04,"b'Facebook, Google and Twitter, not to mention the Corrupt Media, are sooo on the side of the Radical Left Democrats.\xe2\x80\xa6 https://t.co/O6n2H7RrM0'"
1107997913584726020,2019-03-19 13:31:02,b'\xe2\x80\x9cYou can\xe2\x80\x99t dispel this mood of positive energy.\xe2\x80\x9d  @Varneyco  The Economy is Great!'
1107983725034463232,2019-03-19 12:34:40,b'A total loser! https://t.co/vm3Vv2f9jf'
1107981131012628481,2019-03-19 12:24:21,b'The Fake News Media has NEVER been more Dishonest or Corrupt than it is right now. There has never been a time like\xe2\x80\xa6 https://t.co/908OA9aZf4'
1107851414779379712,2019-03-19 03:48:54,b'https://t.co/h2bZ1p3UlY'
1107818672393990145,2019-03-19 01:38:48,b'https://t.co/QxJBMTAZqG'
1107817082723450880,2019-03-19 01:32:29,"b'Rep. Devin Nunes Files $250M Defamation Lawsuit Against Twitter, Two Anonymous Twitter Accounts https://t.co/fT9ZXdWg7z via @thedailybeast'"
1107771030385426432,2019-03-18 22:29:29,"b'While the press doesn\xe2\x80\x99t like writing about it, nor do I need them to, I donate my yearly Presidential salary of $40\xe2\x80\xa6 https://t.co/nIxoD7bCZZ'"
1107757465691656192,2019-03-18 21:35:35,b'https://t.co/precsXDarx'
1107747850845331456,2019-03-18 20:57:23,b'Our prayers are with the great people of South Dakota. We are staying in close contact with @GovKristiNoem and all\xe2\x80\xa6 https://t.co/oXOtL1Lofe'
1107746633230532608,2019-03-18 20:52:32,b'My team is staying in close contact with Governor Kim Reynolds (@IAGovernor) of Iowa and the local officials managi\xe2\x80\xa6 https://t.co/xnRGKec9DB'
1107676046613274626,2019-03-18 16:12:03,b'https://t.co/sb4UfYkFWI'
1107673256268623872,2019-03-18 16:00:58,b'GDP growth during the four quarters of 2018 was the fastest since 2005. This Administration is the first on record\xe2\x80\xa6 https://t.co/FBTIqGdEpe'
1107659841538015232,2019-03-18 15:07:40,"b'Wow! A Suffolk/USA Today Poll, just out, states, \xe2\x80\x9c50% of Americans AGREE that  Robert Mueller\xe2\x80\x99s investigation is a\xe2\x80\xa6 https://t.co/iB5tuOThXA'"
1107637405010530305,2019-03-18 13:38:30,b'The Fake News Media is working overtime to blame me for the horrible attack in New Zealand. They will have to work\xe2\x80\xa6 https://t.co/Z9wFNCqFYf'
1107631297076305920,2019-03-18 13:14:14,b'Joe Biden got tongue tied over the weekend when he was unable to properly deliver a very simple line about his deci\xe2\x80\xa6 https://t.co/HCBKB5DZg0'
1107611445414510592,2019-03-18 11:55:21,b'93% Approval Rating in the Republican Party. Thank you!'
1107608921370513408,2019-03-18 11:45:19,"b'....are all coming back to the U.S. So is everyone else. We now have the best Economy in the World, the envy of all\xe2\x80\xa6 https://t.co/lIG2fQ9tWA'"
1107607058600349696,2019-03-18 11:37:55,"b'General Motors and the UAW are going to start \xe2\x80\x9ctalks\xe2\x80\x9d in September/October. Why wait, start them now! I want jobs t\xe2\x80\xa6 https://t.co/iaPqucQkWS'"
1107462671614570496,2019-03-18 02:04:11,b'MAKE AMERICA GREAT AGAIN!'
1107420505479528448,2019-03-17 23:16:38,"b'What the Democrats have done in trying to steal a Presidential Election, first at the \xe2\x80\x9cballot box\xe2\x80\x9d and then, after\xe2\x80\xa6 https://t.co/dUKlLdMm2A'"
1107408129619382277,2019-03-17 22:27:27,"b'Just spoke to Mary Barra, CEO of General Motors about the Lordstown Ohio plant. I am not happy that it is closed wh\xe2\x80\xa6 https://t.co/2u14Ul3CVA'"
1107400008331116545,2019-03-17 21:55:11,b'RT @williamcraddick: Russiagate was designed in part to help the UK counter Russian influence by baiting the United States into taking a ha\xe2\x80\xa6'
1107399071377944576,2019-03-17 21:51:27,b'RT @JackPosobiec: Why did CNN cut her off after she destroyed their Islamophobia hoax? https://t.co/zYepQbVqn8'
1107397523088527365,2019-03-17 21:45:18,"b'RT @JackPosobiec: \xe2\x80\x9cTeen stabbed about 100 times and set on fire in MS-13 murder, police\xc2\xa0say\xe2\x80\x9d https://t.co/Xrj1j9h7qe'"
1107397436602007557,2019-03-17 21:44:57,"b'RT @LindaSuhler: @realDonaldTrump @FoxNews @ArthelNeville @LelandVittert Absolutely true, President Trump. When those three show up, I turn\xe2\x80\xa6'"
1107397265105264641,2019-03-17 21:44:17,b'RT @SaraCarterDC: POWELL: Andrew Weissmann\xc2\xa0\xe2\x80\x94 The Kingpin Of Prosecutorial Misconduct \xe2\x80\x94 Leaves Mueller\xe2\x80\x99s Squad | The Daily Caller https://t.\xe2\x80\xa6'
1107395796029370368,2019-03-17 21:38:26,"b""RT @WhiteHouse: Happy St. Patrick's Day! \xe2\x98\x98\xef\xb8\x8f https://t.co/GEGdysOWFB"""
1107395404885307392,2019-03-17 21:36:53,b'RT @parscale: David Urban: Trump\xe2\x80\x99s PA popularity no accident | https://t.co/mMJ65vRLhc https://t.co/0XfqEBl4p6'
1107395320596627457,2019-03-17 21:36:33,b'RT @LonewolfnDuke: @Lrihendry https://t.co/eVXFEQCkat'
1107395181534429184,2019-03-17 21:36:00,"b'RT @vmbb12: We have to fight back. They have not let up on President Trump, nor his supporters since they lost. They are losers, we are win\xe2\x80\xa6'"
1107394745033261056,2019-03-17 21:34:16,b'RT @ChuckCallesto: REVEALED: Foreign Government Official Offered Hillary Campaign Dirt On Trump [Details] https://t.co/t9EMftRAIG'
1107394732429402115,2019-03-17 21:34:13,b'RT @ChuckCallesto: BREAKING:  ==&gt; Minnesota Democrats make move to REMOVE Ilhan Omar from Congress...\n\nhttps://t.co/77LYHMQ96K'
1107394098506485760,2019-03-17 21:31:42,b'RT @ChuckCallesto: Christopher Steele Admits Using Posts By \xe2\x80\x98Random Individuals\xe2\x80\x99 From CNN To Back Up Trump Dossier https://t.co/ejhRHBjoBV'
1107393950422388738,2019-03-17 21:31:06,b'RT @ChuckCallesto: President Trump Defends Judge Jeanine After Fox Censors Her Show https://t.co/NodG0t0w2I'
1107392561675681792,2019-03-17 21:25:35,"b'RT @superyayadize: NPR Accidentally Admits Border Fences Are Effective - Over past several decades, migrants have turned to more rugged par\xe2\x80\xa6'"
1107391827865489408,2019-03-17 21:22:40,b'RT @Lrihendry: Meghan MCCain took a swipe at Trump suggesting \xe2\x80\x9cno one will ever love you like they loved my father\xe2\x80\x9d WRONG Meghan! \n\nMillion\xe2\x80\xa6'
1107385751577088000,2019-03-17 20:58:32,b'Those Republican Senators who voted in favor of Strong Border Security (and the Wall) are being uniformly praised a\xe2\x80\xa6 https://t.co/g89d7smVPB'
1107345541724291072,2019-03-17 18:18:45,"b'Were @FoxNews weekend anchors, @ArthelNeville and @LelandVittert, trained by CNN prior to their ratings collapse? I\xe2\x80\xa6 https://t.co/CQssnACCYc'"
1107335457006866435,2019-03-17 17:38:40,"b'Democrat UAW Local 1112 President David Green ought to get his act together and produce. G.M. let our Country down,\xe2\x80\xa6 https://t.co/7TbP2f0gom'"
1107278820267212801,2019-03-17 13:53:37,b'https://t.co/yvJpMzy3R4'
1107276504415854592,2019-03-17 13:44:25,"b'....to the people that got you there. Keep fighting for Tucker, and fight hard for @JudgeJeanine. Your competitors\xe2\x80\xa6 https://t.co/Arc0iPLc26'"
1107273645196537857,2019-03-17 13:33:03,"b'....must stay strong and fight back with vigor. Stop working soooo hard on being politically correct, which will on\xe2\x80\xa6 https://t.co/c2EVgoNKta'"
1107269978678611969,2019-03-17 13:18:29,"b'Bring back @JudgeJeanine Pirro. The Radical Left Democrats, working closely with their beloved partner, the Fake Ne\xe2\x80\xa6 https://t.co/iANGppppsq'"
1107262810327785472,2019-03-17 12:50:00,b'Happy St. Patrick\xe2\x80\x99s Day! \xe2\x98\x98\xef\xb8\x8f https://t.co/WmuNzJSRr8'
1107260609974943745,2019-03-17 12:41:15,b'So it was indeed (just proven in court papers) \xe2\x80\x9clast in his class\xe2\x80\x9d (Annapolis) John McCain that sent the Fake Dossi\xe2\x80\xa6 https://t.co/vuXGVxaT8m'
1107256142584078336,2019-03-17 12:23:30,b'Report: Christopher Steele backed up his Democrat &amp; Crooked Hillary paid for Fake &amp; Unverified Dossier with informa\xe2\x80\xa6 https://t.co/hQQwvWctgm'
1107253742271901696,2019-03-17 12:13:58,"b'....Should Federal Election Commission and/or FCC look into this? There must be Collusion with the Democrats and, o\xe2\x80\xa6 https://t.co/eIt9NuN3S5'"
1107250037854212096,2019-03-17 11:59:15,"b'It\xe2\x80\x99s truly incredible that shows like Saturday Night Live, not funny/no talent, can spend all of their time knockin\xe2\x80\xa6 https://t.co/6qJqiP3j2Q'"
1107032509827690496,2019-03-16 21:34:52,b'RT @realDonaldTrump: I\xe2\x80\x99d like to thank all of the Great Republican Senators who bravely voted for Strong Border Security and the WALL. This\xe2\x80\xa6'
1107032377673551872,2019-03-16 21:34:21,b'RT @realDonaldTrump: .....THIS SHOULD NEVER HAPPEN TO A PRESIDENT AGAIN!'
1107032366000816129,2019-03-16 21:34:18,b'RT @realDonaldTrump: ....should never have been appointed and there should be no Mueller Report. This was an illegal &amp; conflicted investiga\xe2\x80\xa6'
1107032354491715585,2019-03-16 21:34:15,"b'RT @realDonaldTrump: So, if there was knowingly &amp; acknowledged to be \xe2\x80\x9czero\xe2\x80\x9d crime when the Special Counsel was appointed, and if the appoin\xe2\x80\xa6'"
1107032308626935808,2019-03-16 21:34:04,"b'RT @realDonaldTrump: \xe2\x80\x9cNew evidence that the Obama era team of the FBI, DOJ &amp; CIA were working together to Spy on (and take out) President T\xe2\x80\xa6'"
1107029377123057664,2019-03-16 21:22:25,b'How is the Paris Environmental Accord working out for France? After 18 weeks of rioting by the Yellow Vest Proteste\xe2\x80\xa6 https://t.co/GIfPBvVS75'
1107025689486737410,2019-03-16 21:07:46,"b'Google is helping China and their military, but not the U.S. Terrible! The good news is that they helped Crooked Hi\xe2\x80\xa6 https://t.co/HZR9VdsBgg'"
1107024074184761344,2019-03-16 21:01:21,"b'Because the economy is so good, General Motors must get their Lordstown, Ohio, plant open, maybe in a different for\xe2\x80\xa6 https://t.co/bOCWl9EA2U'"
1107020360803909632,2019-03-16 20:46:36,b'Spreading the fake and totally discredited Dossier \xe2\x80\x9cis unfortunately a very dark stain against John McCain.\xe2\x80\x9d Ken St\xe2\x80\xa6 https://t.co/04XT5SvOXt'
1107001687208878085,2019-03-16 19:32:23,b'This is a National Emergency...\nhttps://t.co/AAKBuNW2ro'
1106995964198428672,2019-03-16 19:09:39,"b'RT @WhiteHouse: Sheriff Hodgson: ""Mr. President, you have stood up and you\xe2\x80\x99ve taken the action. And the American people are behind you and\xe2\x80\xa6'"
1106995952739667968,2019-03-16 19:09:36,"b'RT @WhiteHouse: Sheriff Louderback: ""The sheriffs and men and women of law enforcement in this room and across this nation owe you a debt o\xe2\x80\xa6'"
1106987911185162245,2019-03-16 18:37:39,b'RT @WhiteHouse: Attorney General Bill Barr: \xe2\x80\x9cThe crisis that we\xe2\x80\x99re dealing with today is right on our door step and it presents a real clea\xe2\x80\xa6'
1106973110786494466,2019-03-16 17:38:50,"b'Mark Morgan, Former Border Patrol Chief with great experience in Law Enforcement, really understands the subjects o\xe2\x80\xa6 https://t.co/Ay6GKh2Wh8'"
1106969569057538048,2019-03-16 17:24:46,b'https://t.co/WQThgHWcg4'
1106952458339786754,2019-03-16 16:16:46,b'Veto Message to the House of Representatives for H.J. Res. 46: https://t.co/9Z5JHAUv6N https://t.co/lA4RSYTZo0'
1106950918027821056,2019-03-16 16:10:39,b'https://t.co/oCPqP4v1fH'
1106949834739720192,2019-03-16 16:06:21,"b'On the recent non-binding vote (420-0) in Congress about releasing the Mueller Report, I told leadership to let all\xe2\x80\xa6 https://t.co/4DtDtAy0PH'"
1106947324293586946,2019-03-16 15:56:22,b'https://t.co/lopau8H33l'
1106945870220677120,2019-03-16 15:50:36,b'https://t.co/B6NgsZuJdy'
1106665436865851394,2019-03-15 21:16:15,"b'Just spoke w/ @GovRicketts. The people of Nebraska &amp; across the Midwest, especially the Farmers &amp; Ranchers, are fee\xe2\x80\xa6 https://t.co/xMDFlGBQ5f'"
1106657835646156800,2019-03-15 20:46:03,b'https://t.co/tEgQFkcMs1'
1106634712871784448,2019-03-15 19:14:10,"b'....that we stand in solidarity with New Zealand \xe2\x80\x93 and that any assistance the U.S.A. can give, we stand by ready t\xe2\x80\xa6 https://t.co/SLKQsdFs94'"
1106634711290531840,2019-03-15 19:14:10,"b'Just spoke with Jacinda Ardern, the Prime Minister of New Zealand, regarding the horrific events that have taken pl\xe2\x80\xa6 https://t.co/BmvAUccmsb'"
1106611696548884480,2019-03-15 17:42:42,b'I\xe2\x80\x99d like to thank all of the Great Republican Senators who bravely voted for Strong Border Security and the WALL. T\xe2\x80\xa6 https://t.co/lNJqHOgSdQ'
1106554754715533313,2019-03-15 13:56:26,b'.....THIS SHOULD NEVER HAPPEN TO A PRESIDENT AGAIN!'
1106554458383806467,2019-03-15 13:55:16,b'....should never have been appointed and there should be no Mueller Report. This was an illegal &amp; conflicted invest\xe2\x80\xa6 https://t.co/DjItj3uY04'
1106552621152780289,2019-03-15 13:47:58,"b'So, if there was knowingly &amp; acknowledged to be \xe2\x80\x9czero\xe2\x80\x9d crime when the Special Counsel was appointed, and if the app\xe2\x80\xa6 https://t.co/FqwNKuhMNq'"
1106529365549084672,2019-03-15 12:15:33,"b'\xe2\x80\x9cNew evidence that the Obama era team of the FBI, DOJ &amp; CIA were working together to Spy on (and take out) Presiden\xe2\x80\xa6 https://t.co/tzl1qum5Wb'"
1106526246144487424,2019-03-15 12:03:10,b'The \xe2\x80\x98Jexodus\xe2\x80\x99 movement encourages Jewish people to leave the Democrat Party. Total disrespect! Republicans are wait\xe2\x80\xa6 https://t.co/4rl8fwV7OM'
1106520743855251456,2019-03-15 11:41:18,b'My warmest sympathy and best wishes goes out to the people of New Zealand after the horrible massacre in the Mosque\xe2\x80\xa6 https://t.co/aS3y2KQGCP'
1106382310914617344,2019-03-15 02:31:13,b'https://t.co/884dpZi52P'
1106279613431508992,2019-03-14 19:43:08,b'I look forward to VETOING the just passed Democrat inspired Resolution which would OPEN BORDERS while increasing Cr\xe2\x80\xa6 https://t.co/bVCZrpb9LC'
1106272915488686080,2019-03-14 19:16:31,b'VETO!'
1106228159811330048,2019-03-14 16:18:40,b'Congratulations @Toyota! BIG NEWS for U.S. Auto Workers! The USMCA is already fixing the broken NAFTA deal. https://t.co/f9iHprPk5B'
1106205023548133376,2019-03-14 14:46:44,"b'A vote for today\xe2\x80\x99s resolution by Republican Senators is a vote for Nancy Pelosi, Crime, and the Open Border Democrats!'"
1106196591453577217,2019-03-14 14:13:14,"b'....If, at a later date, Congress wants to update the law, I will support those efforts, but today\xe2\x80\x99s issue is BORDE\xe2\x80\xa6 https://t.co/Wgm5JruZsk'"
1106196590065303552,2019-03-14 14:13:13,b'Prominent legal scholars agree that our actions to address the National Emergency at the Southern Border and to pro\xe2\x80\xa6 https://t.co/bY7mcEVxjq'
1106173343475081217,2019-03-14 12:40:51,b'Happy National Ag Day! https://t.co/hNkOh0TqvW'
1106169458106744834,2019-03-14 12:25:25,"b'The three very weak and untalented late night \xe2\x80\x9chosts\xe2\x80\x9d are \xe2\x80\x9cfighting over table scraps. Carson did a great job, it w\xe2\x80\xa6 https://t.co/rZPN91mvu3'"
1106161655292010502,2019-03-14 11:54:24,"b'The Democrats are \xe2\x80\x9cBorder Deniers.\xe2\x80\x9d They refuse to see or acknowledge the Death, Crime, Drugs and Human Trafficking at our Southern Border!'"
1106153554518130688,2019-03-14 11:22:13,b'My Administration looks forward to negotiating a large scale Trade Deal with the United Kingdom. The potential is unlimited!'
1106144173458161664,2019-03-14 10:44:56,b'A big National Emergency vote today by The United States Senate on Border Security &amp; the Wall (which is already und\xe2\x80\xa6 https://t.co/0D9N0UFaIk'
1106140067121246214,2019-03-14 10:28:37,b'\xe2\x80\x9cDemocrats are frantic to throw something else at the President. That\xe2\x80\x99s why you saw those 81 subpoenas. It\xe2\x80\x99s ridicu\xe2\x80\xa6 https://t.co/gUHhKL0epl'
1106000110373212161,2019-03-14 01:12:29,"b'RT @WhiteHouse: January 16, 2019: 247 illegal migrants rush the border in New Mexico.\n\nThis is a national emergency. https://t.co/I6tLEQkbnX'"
1105964934125576192,2019-03-13 22:52:42,b'I agree with Rand Paul. This is a total disgrace and should NEVER happen to another President! https://t.co/czcUbee9x7'
1105963623086727169,2019-03-13 22:47:30,b'\xe2\x80\x9cThe Lisa Page (FBI) transcript also confirms earlier reporting that Page testified Russian Collusion was still unp\xe2\x80\xa6 https://t.co/EVGZLsxZXt'
1105960676097441793,2019-03-13 22:35:47,b'\xe2\x80\x9cDouble Standard - Former FBI lawyer (Lisa Page) admits being told to go easy on Clinton.\xe2\x80\x9d  Very unfair!  @FoxNews'
1105904905888415744,2019-03-13 18:54:10,b'https://t.co/2qWkPuFDL6'
1105873274804813824,2019-03-13 16:48:29,b'Republican Senators are overthinking tomorrow\xe2\x80\x99s vote on National Emergency. It is very simply Border Security/No Cr\xe2\x80\xa6 https://t.co/RuQzOUPmi3'
1105871954001739782,2019-03-13 16:43:14,b'Democrats will have a unanimous vote on a 20% issue in opposing Republican Senators tomorrow. The Dems are for Open Borders and Crime!'
1105838146057588737,2019-03-13 14:28:54,b'RT @GeraldoRivera: @SpeakerPelosi statements vs #Impeachment are refreshing &amp; conciliatory. Her conclusion that attempting to remove @realD\xe2\x80\xa6'
1105838130685493248,2019-03-13 14:28:50,"b'RT @GeraldoRivera: As #RobertMueller approaches the end, interesting how little anti-Trumpers are invoking infamous #SteeleDossier the tabl\xe2\x80\xa6'"
1105837617633992704,2019-03-13 14:26:48,b'RT @DiamondandSilk: AG Letitia James of New York is abusing her power by targeting the POTUS.  Using the Attorney General office as a weapo\xe2\x80\xa6'
1105834434962571265,2019-03-13 14:14:09,b'Comey testified (under oath) that it was a \xe2\x80\x9cunanimous\xe2\x80\x9d decision on Crooked Hillary. Lisa Page transcripts show he LIED. @jasoninthehouse'
1105827007991025666,2019-03-13 13:44:38,"b'The Fake News photoshopped pictures of Melania, then propelled conspiracy theories that it\xe2\x80\x99s actually not her by my\xe2\x80\xa6 https://t.co/3HIN4F7uCS'"
1105805989545021440,2019-03-13 12:21:07,"b'The just revealed FBI Agent Lisa Page transcripts make the Obama Justice Department look exactly like it was, a bro\xe2\x80\xa6 https://t.co/HO96L9Hfcc'"
1105795445794717697,2019-03-13 11:39:13,"b'Defying voters, the Governor of California will halt all death penalty executions of 737 stone cold killers. Friend\xe2\x80\xa6 https://t.co/GEITgYJNdY'"
1105789962576973824,2019-03-13 11:17:26,b'KEEP AMERICA GREAT!'
1105789862853128192,2019-03-13 11:17:02,b'MAKE AMERICA GREAT AGAIN!'
1105789414565908480,2019-03-13 11:15:15,b'\xe2\x80\x9cJay Leno points out that comedy (on the very boring late night shows) is totally one-sided. It\xe2\x80\x99s tough when there\xe2\x80\x99\xe2\x80\xa6 https://t.co/TK14BXw6yC'
1105783271412113409,2019-03-13 10:50:51,"b'....a man who is considered by many to be the President with the most successful first two years in history, especi\xe2\x80\xa6 https://t.co/X4fhIQroLC'"
1105783270262927360,2019-03-13 10:50:50,"b'I greatly appreciate Nancy Pelosi\xe2\x80\x99s statement against impeachment, but everyone must remember the minor fact that I\xe2\x80\xa6 https://t.co/NeJx1SLegh'"
1105686760653234176,2019-03-13 04:27:21,b'So many records being set with respect to our Economy. Unemployment numbers among BEST EVER. A beautiful thing to watch!'
1105686693103976449,2019-03-13 04:27:04,b'All part of the Witch Hunt Hoax. Started by little Eric Schneiderman &amp; Cuomo. So many leaving New York! https://t.co/5HCCNFZXFN'
1105681674896138241,2019-03-13 04:07:08,"b'RT @LindaSuhler: Dear God,\nThank you for answering our prayers.\nA grateful Nation\n\n#GodBlessAmerica\xf0\x9f\x87\xba\xf0\x9f\x87\xb8 #PresidentTrump #ElectionDay https://\xe2\x80\xa6'"
1105681203976384513,2019-03-13 04:05:16,b'RT @Jim_Jordan: Why did @AdamSchiff try to block Congress from learning that the Clinton campaign paid for the Dossier?'
1105681009096445953,2019-03-13 04:04:29,b'RT @Jim_Jordan: Why did @AdamSchiff say that his talks with Michael Cohen were limited to inviting him and allaying any concerns about thre\xe2\x80\xa6'
1105680874723594240,2019-03-13 04:03:57,b'RT @DonaldJTrumpJr: Well done @SteveDaines! As we spoke about on the campaign trail and in hunting camp #publiclands is a big issue for us\xe2\x80\xa6'
1105680121678180353,2019-03-13 04:00:58,b'RT @Jim_Jordan: Why did @AdamSchiff fail to disclose that he met with Glenn Simpson (whose Dossier oppo research was funded by the Clinton\xe2\x80\xa6'
1105675091457855488,2019-03-13 03:40:58,"b'RT @WhiteHouse: All across America, hardworking taxpayers balance their household budgets, find ways to do more with less, and still manage\xe2\x80\xa6'"
1105674270410240000,2019-03-13 03:37:43,"b'RT @IvankaTrump: - Labor force participation of prime-age females reached 76% in January, matching the highest rate since \xe2\x80\x9803\n- Wages are\xe2\x80\xa6'"
1105674211765506048,2019-03-13 03:37:29,b'RT @IvankaTrump: America\xe2\x80\x99s economy is stronger than ever &amp; women in the workforce are thriving:\n- Female unemployment reached its       LOW\xe2\x80\xa6'
1105673539087147008,2019-03-13 03:34:48,"b'RT @WhiteHouseCEA: Real average hourly earnings rose 1.9% during the past 12 months, well exceeding the 0.4% pace during the year-earlier p\xe2\x80\xa6'"
1105673440294518784,2019-03-13 03:34:25,b'RT @VP: Thank you @CUNA for hosting me today!\nAs I told their members: we\xe2\x80\x99re asking every member of the US Senate: A vote against the Presi\xe2\x80\xa6'
1105672409657626624,2019-03-13 03:30:19,"b'RT @dcexaminer: For the first time in his presidency, @realDonaldTrump flipped an appeals court to now have a majority of Republican-appoin\xe2\x80\xa6'"
1105672272252149760,2019-03-13 03:29:46,"b'RT @WhiteHouse: Today, President @realDonaldTrump signed the John D. Dingell, Jr. Conservation, Management, and Recreation Act, which prote\xe2\x80\xa6'"
1105671877798825989,2019-03-13 03:28:12,"b'RT @WhiteHouse: More good news today: \xe2\x80\x9cReal wages for American families are soaring,\xe2\x80\x9d says @WhiteHouseCEA. And along with those rising wage\xe2\x80\xa6'"
1105593613386428417,2019-03-12 22:17:13,"b'New York State and its Governor, Andrew Cuomo, are now proud members of the group of PRESIDENTIAL HARASSERS. No won\xe2\x80\xa6 https://t.co/l1Oo6thAdO'"
1105505655790751744,2019-03-12 16:27:42,"b'RT @FLOTUS: While you may never personally become addicted, the chances of knowing someone who struggles with it are high. If you, or someo\xe2\x80\xa6'"
1105471621672960000,2019-03-12 14:12:27,"b'....needed, and the complexity creates danger. All of this for great cost yet very little gain. I don\xe2\x80\x99t know about\xe2\x80\xa6 https://t.co/f9uhWbol5X'"
1105468569800839169,2019-03-12 14:00:20,"b'Airplanes are becoming far too complex to fly. Pilots are no longer needed, but rather computer scientists from MIT\xe2\x80\xa6 https://t.co/wK9MYEqT1G'"
1105445788585467904,2019-03-12 12:29:48,"b'Patrick Moore, co-founder of Greenpeace: \xe2\x80\x9cThe whole climate crisis is not only Fake News, it\xe2\x80\x99s Fake Science. There\xe2\x80\xa6 https://t.co/bFSnDQNsD7'"
1105441310041878530,2019-03-12 12:12:01,b'\xe2\x80\x9cJewish people are leaving the Democratic Party. We saw a lot of anti Israel policies start under the Obama Adminis\xe2\x80\xa6 https://t.co/vnZw000S9o'
