id,created_at,text
1085922020376920065,2019-01-17 15:29:19,b'RT @Lrihendry: @realDonaldTrump They are eaten alive by hate for our President &amp; his voters! \n\nThey care more about illegal immigrants than\xe2\x80\xa6'
1085915768003256321,2019-01-17 15:04:29,b'So funny to watch Schumer groveling. He called for the firing of bad cop James Comey many times - UNTIL I FIRED HIM!'
1085900696539615232,2019-01-17 14:04:35,b'The Left has become totally unhinged. They no longer care what is Right for our Countrty!'
1085519375224983552,2019-01-16 12:49:21,b'It is becoming more and more obvious that the Radical Democrats are a Party of open borders and crime. They want no\xe2\x80\xa6 https://t.co/okBk72spet'
1085515276228153345,2019-01-16 12:33:04,"b'There are now 77 major or significant Walls built around the world, with 45 countries planning or building Walls. O\xe2\x80\xa6 https://t.co/63DhNXLHhd'"
1085207864224960519,2019-01-15 16:11:31,b'Great being with the National Champion Clemson Tigers last night at the White House. Because of the Shutdown I serv\xe2\x80\xa6 https://t.co/bsowttBjnr'
1085194521036546049,2019-01-15 15:18:30,b'Congratulations @ClemsonFB! https://t.co/w8viax0OWY'
1085166206095630336,2019-01-15 13:25:59,b'Why is Nancy Pelosi getting paid when people who are working are not?'
1085164108117348353,2019-01-15 13:17:39,b'RT @TomFitton: We must stand with the rule of law against the coup targeting @RealDonaldTrump. https://t.co/wmox2XM7x8 https://t.co/8NY79Hv\xe2\x80\xa6'
1085164042791145473,2019-01-15 13:17:23,"b'RT @TomFitton: For the first time in a generation, we have a president who is beginning to tell the truth about the crisis on the border. @\xe2\x80\xa6'"
1085163148678782978,2019-01-15 13:13:50,"b""RT @paulsperry_: So...by the FBI's post-Trump standards for C.I. investigations, would this off-mike exchange between Obama &amp; Putin's deput\xe2\x80\xa6"""
1085160990919012353,2019-01-15 13:05:16,"b""RT @paulsperry_: BREAKING: Inspector General Michael Horowitz still does NOT have all of Peter Strzok's and Lisa Page's texts, even though\xe2\x80\xa6"""
1085160738992373760,2019-01-15 13:04:16,"b'RT @charliekirk11: GREAT AGAIN:\n\nPrior to 2018, unemployment has only been below 4% 5 times since 1970\n\nUnder Donald Trump, in 2018, unempl\xe2\x80\xa6'"
1085160630024327168,2019-01-15 13:03:50,"b'RT @charliekirk11: No one accused Obama of being a Russian agent after he asked for \xe2\x80\x9cmore flexibility\xe2\x80\x9d until after the the election, or whe\xe2\x80\xa6'"
1085160377435021312,2019-01-15 13:02:49,b'RT @MZHemingway: NYT Reveals FBI Retaliated Against Trump For Lawfully Firing Comey https://t.co/LwJ7w1ctom'
1085160256362156034,2019-01-15 13:02:21,"b'RT @DonaldJTrumpJr: Since January 1, neither CNN nor MSNBC has booked a single Angel Mom \xe2\x80\x94 mothers of children brutally murdered by illegal\xe2\x80\xa6'"
1085160210568753154,2019-01-15 13:02:10,"b'RT @DonaldJTrumpJr: Worth the read. \n\nI\xe2\x80\x99m A Senior Trump Official, And I Hope A Long Shutdown Smokes Out The Resistance https://t.co/6ahfOl\xe2\x80\xa6'"
1085160070374195200,2019-01-15 13:01:36,b'RT @PARISDENNARD: I trust a rancher on the Southern border more than a liberal politician from Northern California https://t.co/mo4oWe1SnI'
1085156987183263749,2019-01-15 12:49:21,b'Polls are now showing that people are beginning to understand the Humanitarian Crisis and Crime at the Border. Numb\xe2\x80\xa6 https://t.co/Ds3sNXub7c'
1085154110108848128,2019-01-15 12:37:55,b'A big new Caravan is heading up to our Southern Border from Honduras. Tell Nancy and Chuck that a drone flying arou\xe2\x80\xa6 https://t.co/kc4H4PNR54'
1085151045922234368,2019-01-15 12:25:45,"b'Volkswagen will be spending 800 million dollars in Chattanooga, Tennessee. They will be making Electric Cars. Congr\xe2\x80\xa6 https://t.co/BtLvwvepcv'"
1085148593617555456,2019-01-15 12:16:00,"b'Just announced that Veterans unemployment has reached an 18 year low, really good news for our Vets and their famil\xe2\x80\xa6 https://t.co/iU676pPe6o'"
1085144283437506560,2019-01-15 11:58:52,b'The rank and file of the FBI are great people who are disgusted with what they are learning about Lyin\xe2\x80\x99 James Comey\xe2\x80\xa6 https://t.co/4zcYDrMv9s'
1084938164387508224,2019-01-14 22:19:50,"b'....I am doing exactly what I pledged to do, and what I was elected to do by the citizens of our great Country. Jus\xe2\x80\xa6 https://t.co/FN809gnJ7a'"
1084938160516169729,2019-01-14 22:19:49,"b'For decades, politicians promised to secure the border, fix our trade deals, bring back our factories, get tough on\xe2\x80\xa6 https://t.co/EsmNE87U9L'"
1084936400212963329,2019-01-14 22:12:49,b'Spoke w/ President Erdogan of Turkey to advise where we stand on all matters including our last two weeks of succes\xe2\x80\xa6 https://t.co/v9g0jPn3H4'
1084912619390029824,2019-01-14 20:38:19,"b'RT @DonaldJTrumpJr: \xe2\x80\x98Angel mom\xe2\x80\x99 demands Trump\xe2\x80\x99s wall, \xe2\x80\x98we\xe2\x80\x99ve become collateral damage\xe2\x80\x99 https://t.co/FoUPO11tmM'"
1084912472073498624,2019-01-14 20:37:44,b'RT @DonaldJTrumpJr: Silence of the Moms: Media Refuse to Discuss Angel Families https://t.co/AoVIquJge2 via @BreitbartNews'
1084900086533025795,2019-01-14 19:48:31,"b""RT @WhiteHouse: President Trump Delivers Remarks at the American Farm Bureau Federation's 100th Annual Convention https://t.co/tMWj5zj3K0"""
1084883995886800896,2019-01-14 18:44:35,b'Getting ready to go on stage at the #AFBF100 in New Orleans - packed house! I will try and match the great game pla\xe2\x80\xa6 https://t.co/JvTpUlkus6'
1084839940972638208,2019-01-14 15:49:31,b'https://t.co/w5X8jqvtiS'
1084808599124221954,2019-01-14 13:44:59,"b'The Fake News gets crazier and more dishonest every single day. Amazing to watch as certain people covering me, and\xe2\x80\xa6 https://t.co/kIEcksBJbm'"
1084791040291282944,2019-01-14 12:35:13,b'\xe2\x80\x9cDems in Puerto Rico as Shutdown hits day 24.\xe2\x80\x9d @foxandfriends'
1084788796011491330,2019-01-14 12:26:18,"b'Nancy and Cryin\xe2\x80\x99 Chuck can end the Shutdown in 15 minutes. At this point it has become their, and the Democrats, fault!'"
1084788012725166080,2019-01-14 12:23:11,b'I\xe2\x80\x99ve been waiting all weekend. Democrats must get to work now. Border must be secured!'
1084787164574040064,2019-01-14 12:19:49,"b'RT @GOPChairwoman: Smugglers are flooding our communities with drugs.\n\n*300 Americans die each week from heroin, 90% of it comes from south\xe2\x80\xa6'"
1084786926367002624,2019-01-14 12:18:52,b'RT @GOPChairwoman: Economic policies that @realDonaldTrump and @IvankaTrump have championed are producing some fantastic results for Americ\xe2\x80\xa6'
1084786824516653057,2019-01-14 12:18:27,"b'RT @GeraldoRivera: Based on the record, the allegation/suggestion that the #FBI came close to investigating @realDonaldTrump as a Russian s\xe2\x80\xa6'"
1084786623320150016,2019-01-14 12:17:40,"b'RT @GOPChairwoman: Chuck Schumer and Nancy Pelosi are not negotiating in good faith with @realDonaldTrump.\n \nInstead, Congressional Democra\xe2\x80\xa6'"
1084786495398072320,2019-01-14 12:17:09,"b""RT @GOPChairwoman: It didn't get the attention it deserved, but @realDonaldTrump recently signed a bill into law that will empower women al\xe2\x80\xa6"""
1084785809000185862,2019-01-14 12:14:25,b'\xe2\x80\x9cGas prices drop across the United States because President Trump has deregulated Energy and we are now  producing\xe2\x80\xa6 https://t.co/OPhGVLtuX9'
1084650944846012417,2019-01-14 03:18:31,"b'....Border is eventually going to be militarized and defended or the United States, as we have known it, is going t\xe2\x80\xa6 https://t.co/PSdYpgClqn'"
1084649448003784704,2019-01-14 03:12:34,"b'The Trump portrait of an unsustainable Border Crisis is dead on. \xe2\x80\x9cIn the last two years, ICE officers made 266,000\xe2\x80\xa6 https://t.co/DIeYaeQrCr'"
1084647050208333825,2019-01-14 03:03:03,"b'Best line in the Elizabeth Warren beer catastrophe is, to her husband, \xe2\x80\x9cThank you for being here. I\xe2\x80\x99m glad you\xe2\x80\x99re h\xe2\x80\xa6 https://t.co/oJc4xd0ztN'"
1084644517238714369,2019-01-14 02:52:59,"b'If Elizabeth Warren, often referred to by me as Pocahontas, did this commercial from Bighorn or Wounded Knee instea\xe2\x80\xa6 https://t.co/iBFJ5jsr2F'"
1084627451983073280,2019-01-14 01:45:10,"b'So sorry to hear the news about Jeff Bozo being taken down by a competitor whose reporting, I understand, is far mo\xe2\x80\xa6 https://t.co/ihKoPOyQZZ'"
1084586625672376322,2019-01-13 23:02:56,"b'....Likewise, do not want the Kurds to provoke Turkey. Russia, Iran and Syria have been the biggest beneficiaries o\xe2\x80\xa6 https://t.co/wADyQZ15eg'"
1084584259510304768,2019-01-13 22:53:32,"b'Starting the long overdue pullout from Syria while hitting the little remaining ISIS territorial caliphate hard, an\xe2\x80\xa6 https://t.co/IsQCp2ES5s'"
1084571124556619776,2019-01-13 22:01:21,b'Wish I could share with everyone the beauty and majesty of being in the White House and looking outside at the snow\xe2\x80\xa6 https://t.co/7mci5PqAs0'
1084476603269373953,2019-01-13 15:45:45,b'Thousands of illegal aliens who have committed sexual crimes against children are right now in Texas prisons. Most\xe2\x80\xa6 https://t.co/DJF95PoNKx'
1084474165976018944,2019-01-13 15:36:04,"b'The damage done to our Country from a badly broken Border - Drugs, Crime and so much that is bad - is far greater t\xe2\x80\xa6 https://t.co/ljYwJAqAFO'"
1084466503574016006,2019-01-13 15:05:37,"b'I\xe2\x80\x99m in the White House, waiting. The Democrats are everywhere but Washington as people await their pay. They are ha\xe2\x80\xa6 https://t.co/NDBmrpWNvb'"
1084465310848163840,2019-01-13 15:00:53,b'The building of the Wall on the Southern Border will bring down the crime rate throughout the entire Country!'
1084464695904530432,2019-01-13 14:58:26,b'Democrats are saying that DACA is not worth it and don\xe2\x80\x99t want to include in talks. Many Hispanics will be coming ov\xe2\x80\xa6 https://t.co/3pdTiBOaCp'
1084263052617412609,2019-01-13 01:37:11,b'I will be interviewed by Jeanine Pirro at 9:00 P.M. on @FoxNews. Watch @JesseBWatters before and @greggutfeld after\xe2\x80\xa6 https://t.co/ZGdntcwrzN'
1084153087785349125,2019-01-12 18:20:13,b'https://t.co/3IH1yW2eTg'
1084121557193146368,2019-01-12 16:14:55,b'We have a massive Humanitarian Crisis at our Southern Border. We will be out for a long time unless the Democrats c\xe2\x80\xa6 https://t.co/SgnYIlngkR'
1084119654841364480,2019-01-12 16:07:22,b'....I do have a plan on the Shutdown. But to understand that plan you would have to understand the fact that I won\xe2\x80\xa6 https://t.co/hu2uHx1GvU'
1084117143988461571,2019-01-12 15:57:23,"b'I just watched a Fake reporter from the Amazon Washington Post say the White House is \xe2\x80\x9cchaotic, there does not seem\xe2\x80\xa6 https://t.co/2f1GMddbdV'"
1084099445556502528,2019-01-12 14:47:04,b'Democrats could solve the Shutdown in 15 minutes! Call your Dem Senator or Congresswoman/man. Tell them to get it done! Humanitarian Crisis.'
1084098258534891521,2019-01-12 14:42:21,"b'23% of Federal inmates are illegal immigrants. Border arrests are up 240%. In the Great State of Texas, between 201\xe2\x80\xa6 https://t.co/Gni9Vvz4rB'"
1084094708144619525,2019-01-12 14:28:14,"b'Democrats should come back to Washington and work to end the Shutdown, while at the same time ending the horrible h\xe2\x80\xa6 https://t.co/kIz5PU3to2'"
1084092774633353217,2019-01-12 14:20:33,"b'Lyin\xe2\x80\x99 James Comey, Andrew McCabe, Peter S and his lover, agent Lisa Page, &amp; more, all disgraced and/or fired and ca\xe2\x80\xa6 https://t.co/sdzlOf2L47'"
1084074865496334336,2019-01-12 13:09:23,"b'I have been FAR tougher on Russia than Obama, Bush or Clinton. Maybe tougher than any other President. At the same\xe2\x80\xa6 https://t.co/P6PuseTkim'"
1084070845826371586,2019-01-12 12:53:25,"b'.....who is being totally protected by his best friend, Bob Mueller, &amp; the 13 Angry Democrats - leaking machines wh\xe2\x80\xa6 https://t.co/4h7ZsZx3Jn'"
1084065832941031424,2019-01-12 12:33:30,b'....the FBI was in complete turmoil (see N.Y. Post) because of Comey\xe2\x80\x99s poor leadership and the way he handled the C\xe2\x80\xa6 https://t.co/FVmQRURRBe'
1084062079907229697,2019-01-12 12:18:35,"b'...Funny thing about James Comey. Everybody wanted him fired, Republican and Democrat alike. After the rigged &amp; bot\xe2\x80\xa6 https://t.co/r5tKMsOxMu'"
1084058813047681025,2019-01-12 12:05:36,"b'Wow, just learned in the Failing New York Times that the corrupt former leaders of the FBI, almost all fired or for\xe2\x80\xa6 https://t.co/w6DbjxRfnC'"
1083868608919420930,2019-01-11 23:29:48,b'.@CNN called a San Diego news station (@KUSINews) for negative reports on the Wall. When the station said that Wall\xe2\x80\xa6 https://t.co/nigpO3Oixw'
1083866566314389504,2019-01-11 23:21:41,"b'Drug prices declined in 2018, the first time in nearly half a century. During the first 19 months of my Administrat\xe2\x80\xa6 https://t.co/xx4B9lKTx8'"
1083861205549232128,2019-01-11 23:00:23,"b'I look forward to hosting, right out of the great State of South Carolina, the 2019 NCAA Football Champion Clemson\xe2\x80\xa6 https://t.co/IByyRxfwYa'"
1083848923297579009,2019-01-11 22:11:34,b'RT @WhiteHouse: This is common sense. Congress must pass a bill that ends the crisis at our border. https://t.co/wD0PPKfpNM'
1083848903072645120,2019-01-11 22:11:30,"b'RT @WhiteHouse: This afternoon, President Trump hosted a roundtable discussion with State, local, and community leaders, who spoke on how t\xe2\x80\xa6'"
1083783112973320192,2019-01-11 17:50:04,b'The Fake News Media keeps saying we haven\xe2\x80\x99t built any NEW WALL. Below is a section just completed on the Border. An\xe2\x80\xa6 https://t.co/2RqbrNEznu'
1083759500618805254,2019-01-11 16:16:14,"b'...The Steel Barrier, or Wall, should have been built by previous administrations long ago. They never got it done\xe2\x80\xa6 https://t.co/SsrUV1HMyb'"
1083756525196320773,2019-01-11 16:04:25,b'Humanitarian Crisis at our Southern Border. I just got back and it is a far worse situation than almost anyone woul\xe2\x80\xa6 https://t.co/qeM5wiUfpO'
1083705208834834433,2019-01-11 12:40:30,b'H1-B holders in the United States can rest assured that changes are soon coming which will bring both simplicity an\xe2\x80\xa6 https://t.co/fPL858CYkb'
1083696274182995969,2019-01-11 12:05:00,"b'I often said during rallies, with little variation, that \xe2\x80\x9cMexico will pay for the Wall.\xe2\x80\x9d We have just signed a grea\xe2\x80\xa6 https://t.co/JSF6l6q4bZ'"
1083554843627868160,2019-01-11 02:43:00,b'When I took the Oath of Office.... https://t.co/GDhIqteKpv'
1083554782923632640,2019-01-11 02:42:46,"b'We lose 300 Americans a week, 90% of which comes through the Southern Border. These numbers will be DRASTICALLY REDUCED if we have a Wall!'"
1083540470570143750,2019-01-11 01:45:54,b'Will be interviewed at the Border by @seanhannity on @FoxNews tonight at 9:00. Enjoy!'
1083531644785455104,2019-01-11 01:10:49,b'Dear Diary... https://t.co/NAuMaQW6fl'
1083493944527249408,2019-01-10 22:41:01,b'From the Southern Border.... https://t.co/Vgsf5nEZUH'
1083427505736839168,2019-01-10 18:17:01,b'RT @SenateGOP: Why do we need border security? This is why. These are the facts. #SecureOurBorder https://t.co/dMpYb3p4Wy'
1083426878336036865,2019-01-10 18:14:31,"b'Because of the Democrats intransigence on Border Security and the great importance of Safety for our Nation, I am r\xe2\x80\xa6 https://t.co/PhplWqlvK5'"
1083404900862545920,2019-01-10 16:47:11,"b'President Obama, thank you for your great support \xe2\x80\x93 I have been saying this all along! https://t.co/L506g9Aq4z'"
1083358775925460992,2019-01-10 13:43:54,b'MAKE AMERICA GREAT AGAIN!'
1083358611315789826,2019-01-10 13:43:15,b'Getting ready to leave for the Great State of Texas! #MAGA'
1083358150214979585,2019-01-10 13:41:25,b'\xe2\x80\x9cGreat support for Border Security and the Wall.\xe2\x80\x9d @foxandfriends  Even greater than anyone would know! \xe2\x80\x9cPresidents\xe2\x80\xa6 https://t.co/QCFWUjB1qH'
1083356326833602561,2019-01-10 13:34:10,"b'There is GREAT unity with the Republicans in the House and Senate, despite the Fake News Media working in overdrive\xe2\x80\xa6 https://t.co/JL5UCh8ukM'"
1083353895030702080,2019-01-10 13:24:30,b'Cryin Chuck told his favorite lie when he used his standard sound bite that I \xe2\x80\x9cslammed the table &amp; walked out of th\xe2\x80\xa6 https://t.co/s0M6wHSEjM'
1083214771648937984,2019-01-10 04:11:41,"b'RT @dbongino: New Poll: Vast Majority of Voters Believe There is ""Crisis"" or ""Problem"" at U.S. Border https://t.co/bzFimBid26'"
1083211644275171328,2019-01-10 03:59:15,b'RT @charliekirk11: Governor Ron DeSantis suspends the horrible Sheriff Scott Israel who is largely responsible for the errors leading up to\xe2\x80\xa6'
1083210934984867841,2019-01-10 03:56:26,"b'RT @charliekirk11: Did you know:\n\nAt our Southern Border, in 2018:\n\n1.7 MILLION pounds of narcotics were seized\n\n17,000 criminals were arre\xe2\x80\xa6'"
1083210819691786240,2019-01-10 03:55:59,"b'RT @charliekirk11: President Trump is winning this shutdown fight\n\nDemocrats have no message, and are refusing to open government because t\xe2\x80\xa6'"
1083210698921074688,2019-01-10 03:55:30,b'RT @charliekirk11: This is why we need a wall\n\nIllegal immigration is a serious threat to our country\n\n90% of all heroin comes across the b\xe2\x80\xa6'
1083210083771785216,2019-01-10 03:53:03,"b'Gave an OFF THE RECORD luncheon, somewhat of a White House tradition or custom, to network anchors yesterday - and\xe2\x80\xa6 https://t.co/r6xl4jJQqq'"
1083207607412760576,2019-01-10 03:43:13,b'The Mainstream Media has NEVER been more dishonest than it is now. NBC and MSNBC are going Crazy. They report stori\xe2\x80\xa6 https://t.co/zLh9zOR1J1'
1083099784012091396,2019-01-09 20:34:46,"b'Just left a meeting with Chuck and Nancy, a total waste of time. I asked what is going to happen in 30 days if I qu\xe2\x80\xa6 https://t.co/NQeyjI5TXJ'"
1083083858357248000,2019-01-09 19:31:29,"b""Thank you to all of America's brave police, deputies, sheriffs, and federal law enforcement on National Law Enforce\xe2\x80\xa6 https://t.co/MUgdVhnjb8"""
1083022011574747137,2019-01-09 15:25:43,"b'Billions of dollars are sent to the State of California for Forest fires that, with proper Forest Management, would\xe2\x80\xa6 https://t.co/l5Jyjb8lEs'"
1083001986331672580,2019-01-09 14:06:09,"b'Our Country is doing so well in so many ways. Great jobs numbers, with a record setting December. We are rebuilding\xe2\x80\xa6 https://t.co/LWGj8t2N8L'"
1082857997032919040,2019-01-09 04:33:59,b'Thank you for soooo many nice comments regarding my Oval Office speech. A very interesting experience!'
1082823394234716160,2019-01-09 02:16:29,b'https://t.co/Ft6FqQmYfI'
1082648785312976896,2019-01-08 14:42:39,"b'Congratulations to a truly great football team, the Clemson Tigers, on an incredible win last night against a power\xe2\x80\xa6 https://t.co/1KtCS9qdVU'"
1082627015235256321,2019-01-08 13:16:09,b'Talks with China are going very well!'
1082626249984491520,2019-01-08 13:13:06,b'\xe2\x80\x9cThe President is the biggest and best supporter of the Steel Industry in many years. We are now doing really well.\xe2\x80\xa6 https://t.co/9daGoY2lSy'
1082623264877432837,2019-01-08 13:01:15,b'Economic numbers looking REALLY good. Can you imagine if I had long term ZERO interest rates to play with like the\xe2\x80\xa6 https://t.co/2rGF18wzy0'
1082484663216730113,2019-01-08 03:50:29,"b'Endless Wars, especially those which are fought out of judgement mistakes that were made many years ago, &amp; those wh\xe2\x80\xa6 https://t.co/xib1biZeBG'"
1082347305699889157,2019-01-07 18:44:41,b'I am pleased to inform you that I will Address the Nation on the Humanitarian and National Security crisis on our S\xe2\x80\xa6 https://t.co/hm3hcItIR3'
1082289526339448832,2019-01-07 14:55:05,b'The Failing New York Times has knowingly written a very inaccurate story on my intentions on Syria. No different fr\xe2\x80\xa6 https://t.co/kQrQPlAbJp'
1082270271426433025,2019-01-07 13:38:34,"b'Congressman Adam Smith, the new Chairman of the House Armed Services Committee, just stated, \xe2\x80\x9cYes, there is a provi\xe2\x80\xa6 https://t.co/mWI8gB8CHL'"
1082268365081767936,2019-01-07 13:31:00,b'....The Fake News Media in our Country is the real Opposition Party. It is truly the Enemy of the People! We must b\xe2\x80\xa6 https://t.co/Y3KuJpWBAQ'
1082262839501508609,2019-01-07 13:09:03,"b'...The Fake News will knowingly lie and demean in order make the tremendous success of the Trump Administration, an\xe2\x80\xa6 https://t.co/0g6A2fx5FD'"
1082259636227620865,2019-01-07 12:56:19,"b'With all of the success that our Country is having, including the just released jobs numbers which are off the char\xe2\x80\xa6 https://t.co/Urm1LOV1bb'"
1082032550112047104,2019-01-06 21:53:57,b'V.P. Mike Pence and group had a productive meeting with the Schumer/Pelosi representatives today. Many details of B\xe2\x80\xa6 https://t.co/eBowLn7r54'
1081935373914259458,2019-01-06 15:27:49,b'Our GREAT MILITARY has delivered justice for the heroes lost and wounded in the cowardly attack on the USS Cole. We\xe2\x80\xa6 https://t.co/1grz5I4OQD'
1081928260093652999,2019-01-06 14:59:33,b'Excited to see our friends in Egypt opening the biggest Cathedral in the Middle East. President El-Sisi is moving h\xe2\x80\xa6 https://t.co/3BmIYxMjZF'
1081893492291497984,2019-01-06 12:41:23,"b'RT @realDonaldTrump: How do you impeach a president who has won perhaps the greatest election of all time, done nothing wrong (no Collusion\xe2\x80\xa6'"
1081893412687761408,2019-01-06 12:41:04,"b'RT @realDonaldTrump: As I have stated many times, if the Democrats take over the House or Senate, there will be disruption to the Financial\xe2\x80\xa6'"
1081891545245278208,2019-01-06 12:33:39,b'....The only reason they do not want to build a Wall is that Walls Work! 99% of our illegal Border crossings will e\xe2\x80\xa6 https://t.co/lsbP5iE3OO'
1081883505049636864,2019-01-06 12:01:42,"b'\xe2\x80\x9cWe simply cannot allow people to pour into the United States undetected, undocumented, unchecked...\xe2\x80\x9d Barrack Obama\xe2\x80\xa6 https://t.co/yZRRpupNX2'"
1081735898679701505,2019-01-06 02:15:10,b'https://t.co/iSFAokoIP7'
1081733714437201922,2019-01-06 02:06:29,b'Will be going to Camp David tomorrow morning for meetings on Border Security and many other topics with @WhiteHouse senior staff.'
1081729046277509121,2019-01-06 01:47:56,b'AP-NORC POLL: \xe2\x80\x9cImmigration among the top concerns in 2019.\xe2\x80\x9d People want to stop drugs and criminals at the Border.\xe2\x80\xa6 https://t.co/si6bMulzfe'
1081725924457041921,2019-01-06 01:35:32,"b'\xe2\x80\x9cThe number of employed Americans has now set a 14th record under President Trump. Over the year, average hourly ea\xe2\x80\xa6 https://t.co/T1VFWK1Bge'"
1081717108176752640,2019-01-06 01:00:30,"b'\xe2\x80\x9cJobs up big, plus 312,000. Record number working. Manufacturing best in 20 years (Previous administration said thi\xe2\x80\xa6 https://t.co/glizVLcZC2'"
1081658090792148993,2019-01-05 21:05:59,b'V.P. Mike Pence and team just left the White House. Briefed me on their meeting with the Schumer/Pelosi representat\xe2\x80\xa6 https://t.co/EFnReotJeI'
1081653927337213952,2019-01-05 20:49:27,"b'Drug makers and companies are not living up to their commitments on pricing. Not being fair to the consumer, or to our Country!'"
1081603056846991361,2019-01-05 17:27:18,"b""\xe2\x80\x9cFormer @NYTimes editor Jill Abramson rips paper's \xe2\x80\x98unmistakably anti-Trump\xe2\x80\x99 bias.\xe2\x80\x9d\n\nMs. Abramson is 100% correct.\xe2\x80\xa6 https://t.co/8PZiXgcpOD"""
1081584385512607745,2019-01-05 16:13:07,"b'Great Tweet today by Tyler Q. Houlton @SpoxDHS on the #FakeNews being put out by @CNN, a proud member of the Opposi\xe2\x80\xa6 https://t.co/r7ST8KT1Rj'"
1081579754191552514,2019-01-05 15:54:42,"b'The Democrats want Billions of Dollars for Foreign Aid, but they don\xe2\x80\x99t want to spend a small fraction of that numbe\xe2\x80\xa6 https://t.co/ZSb2KjNkgl'"
1081570073867927557,2019-01-05 15:16:14,"b'We are working hard at the Border, but we need a WALL!  In 2018, 1.7 million pounds of narcotics seized, 17,000 adu\xe2\x80\xa6 https://t.co/xosJ3RS8gQ'"
1081563196249513985,2019-01-05 14:48:55,"b'I don\xe2\x80\x99t care that most of the workers not getting paid are Democrats, I want to stop the Shutdown as soon as we are\xe2\x80\xa6 https://t.co/4zSgavwhD6'"
1081549802595340288,2019-01-05 13:55:41,"b'Many people currently a part of my opposition, including President Obama &amp; the Dems, have had campaign violations,\xe2\x80\xa6 https://t.co/DMPDaBKIYB'"
1081535102461579264,2019-01-05 12:57:17,b'The Democrats could solve the Shutdown problem in a very short period of time. All they have to do is approve REAL\xe2\x80\xa6 https://t.co/Wk7EpL7r4V'
1081528502602612736,2019-01-05 12:31:03,b'Great support coming from all sides for Border Security (including Wall) on our very dangerous Southern Border. Tea\xe2\x80\xa6 https://t.co/dLTuhf1AM7'
1081525114594832384,2019-01-05 12:17:35,b'Thank you to Kanye West for your nice words. Criminal Justice Reform is now law - passed in a very bipartisan way!'
1081357291914477568,2019-01-05 01:10:43,"b'Great new book by Dr. Robert Jeffress, \xe2\x80\x9cChoosing the Extraordinary Life.\xe2\x80\x9d Get it and enjoy!  @LouDobbs'"
